,title,link,keyword
0,Andre Rosiade Bantu Istri Pemulung Pengidap Diabetes Akut di Padang,https://news.detik.com/berita/d-8452634/andre-rosiade-bantu-istri-pemulung-pengidap-diabetes-akut-di-padang,diabetes
1,"Pasien Diabetes Tak Lagi Perlu Minum Obat Seumur Hidup, Asal...",https://health.detik.com/berita-detikhealth/d-8451413/pasien-diabetes-tak-lagi-perlu-minum-obat-seumur-hidup-asal,diabetes
2,Video: Diabetes di Usia 29 gegara Doyan Makan Dessert Viral,https://health.detik.com/detiktv/d-8450596/video-diabetes-di-usia-29-gegara-doyan-makan-dessert-viral,diabetes
3,Video: Waspada Diabetes di Usia Muda,https://20.detik.com/detik-sore/20251230-251230072/video-waspada-diabetes-di-usia-muda,diabetes
4,"Badan Kurus tetapi Kena Diabetes, Ini Penjelasannya!",https://www.detik.com/bali/video/d-8450295/badan-kurus-tetapi-kena-diabetes-ini-penjelasannya,diabetes
5,"Video: Badan Kurus Kok Kena Diabetes? Bisa-bisa Saja, Ini Penjelasannya",https://health.detik.com/detiktv/d-8449938/video-badan-kurus-kok-kena-diabetes-bisa-bisa-saja-ini-penjelasannya,diabetes
6,"Biang Kerok Peningkatan Gagal Ginjal di RI, Pola Makan Ini Picu Hipertensi-Diabetes",https://health.detik.com/diet/d-8449664/biang-kerok-peningkatan-gagal-ginjal-di-ri-pola-makan-ini-picu-hipertensi-diabetes,diabetes
7,Keseruan Senam Sehat di #Hands4Diabetes Bareng Tropicana Slim Jakarta,https://health.detik.com/fotohealth/d-8213434/keseruan-senam-sehat-di-hands4diabetes-bareng-tropicana-slim-jakarta,diabetes
8,18 April Hari Diabetes Nasional dan Kenali Cara Mencegahnya,https://www.detik.com/bali/berita/d-8450035/18-april-hari-diabetes-nasional-dan-kenali-cara-mencegahnya,diabetes
9,"Video: Telur Langsung Masuk Kulkas vs Dicuci Dulu, Mana yang Lebih Aman?",https://health.detik.com/detiktv/d-8450567/video-telur-langsung-masuk-kulkas-vs-dicuci-dulu-mana-yang-lebih-aman,diabetes
10,"Padahal Dianggap Sehat, 7 Makanan Ini Diam-diam Bikin Gula Darah Meningkat",https://health.detik.com/diet/d-8450756/padahal-dianggap-sehat-7-makanan-ini-diam-diam-bikin-gula-darah-meningkat,diabetes
11,"Hits di Kalangan Gen-Z, Benarkah Gula Aren Lebih Sehat? Ini Faktanya",https://health.detik.com/diet/d-8450758/hits-di-kalangan-gen-z-benarkah-gula-aren-lebih-sehat-ini-faktanya,diabetes
12,"Buah Pir Sehabis Makan Manis, Bisa Menetralkan? Ini Faktanya",https://health.detik.com/diet/d-8450848/buah-pir-sehabis-makan-manis-bisa-menetralkan-ini-faktanya,diabetes
13,"Infografis: Dianggap Sehat, Diam-diam Bikin Gula Darah Cepat Meningkat",https://health.detik.com/infografis/d-8449676/infografis-dianggap-sehat-diam-diam-bikin-gula-darah-cepat-meningkat,diabetes
14,Terungkap Pemicu Terbesar Gagal Ginjal Makin Mengkhawatirkan di RI,https://health.detik.com/berita-detikhealth/d-8449103/terungkap-pemicu-terbesar-gagal-ginjal-makin-mengkhawatirkan-di-ri,diabetes
15,Hari Diabetes Sedunia: Diabetes & Well-Being at Work Bersama Tropicana Slim,https://20.detik.com/special-coverage/20251201-251201051/hari-diabetes-sedunia-diabetes-well-being-at-work-bersama-tropicana-slim,diabetes
16,Infografis: Urutan Makan Seperti Ini Efektif Cegah Lonjakan Gula Darah,https://health.detik.com/infografis/d-8450795/infografis-urutan-makan-seperti-ini-efektif-cegah-lonjakan-gula-darah,diabetes
17,"Marak Tren 'Food Order', Benarkah Urutan Makan Pengaruhi Gula Darah?",https://health.detik.com/diet/d-8449859/marak-tren-food-order-benarkah-urutan-makan-pengaruhi-gula-darah,diabetes
18,Kenapa Buah Potong Lebih Sehat Dibanding Jus? Begini Teorinya,https://health.detik.com/diet/d-8451121/kenapa-buah-potong-lebih-sehat-dibanding-jus-begini-teorinya,diabetes
19,"Dikepung Tren Serba Manis, Gen Z Rentan Diabetes-Obesitas",https://health.detik.com/fotohealth/d-8190316/dikepung-tren-serba-manis-gen-z-rentan-diabetes-obesitas,diabetes
20,"Infografis: RI Resmi Luncurkan Nutri Level, Begini Aturannya",https://health.detik.com/infografis/d-8449666/infografis-ri-resmi-luncurkan-nutri-level-begini-aturannya,diabetes
21,"Waspadai 'Liquid Calories', Sumber Asupan Tinggi Gula Tanpa Sinyal Rasa Kenyang",https://health.detik.com/diet/d-8449670/waspadai-liquid-calories-sumber-asupan-tinggi-gula-tanpa-sinyal-rasa-kenyang,diabetes
22,"Infografis: Salah Baca Berujung Gendut, Ini Arti 'Per Sajian' di Label Nutrisi",https://health.detik.com/infografis/d-8451892/infografis-salah-baca-berujung-gendut-ini-arti-per-sajian-di-label-nutrisi,diabetes
23,Jebakan 'Hidden Sugar' di Minuman Manis yang Bikin Warga +62 Rentan Diabetes,https://health.detik.com/berita-detikhealth/d-8437466/jebakan-hidden-sugar-di-minuman-manis-yang-bikin-warga-62-rentan-diabetes,diabetes
24,Wajib Tahu! Ini Bahaya Konsumsi Makanan atau Minuman Manis Berlebihan,https://www.detik.com/sumbagsel/kuliner/d-8450225/wajib-tahu-ini-bahaya-konsumsi-makanan-atau-minuman-manis-berlebihan,diabetes
25,"Banyak Disalahpahami, 5 Minuman Ini Ternyata Baik untuk Gula Darah",https://food.detik.com/info-sehat/d-8447256/banyak-disalahpahami-5-minuman-ini-ternyata-baik-untuk-gula-darah,diabetes
26,"BPOM RI Setujui Nutri-Level, Soroti 73 Persen Warga RI Meninggal Komplikasi Diabetes-Hipertensi",https://health.detik.com/berita-detikhealth/d-8436253/bpom-ri-setujui-nutri-level-soroti-73-persen-warga-ri-meninggal-komplikasi-diabetes-hipertensi,diabetes
27,"Ancaman Gula Berlebih: Manis Sesaat, Diabetes Sepanjang Hayat",https://20.detik.com/leaders-talk/20251103-251103039/ancaman-gula-berlebih-manis-sesaat-diabetes-sepanjang-hayat,diabetes
28,Wamenkes Temukan Banyak Pemudik yang Idap Hipertensi-Diabetes,https://health.detik.com/berita-detikhealth/d-8404513/wamenkes-temukan-banyak-pemudik-yang-idap-hipertensi-diabetes,diabetes
29,"Mengenal Terapi Insulin, Solusi Penderita Diabetes Terhindar Komplikasi",https://www.detik.com/jatim/berita/d-8305817/mengenal-terapi-insulin-solusi-penderita-diabetes-terhindar-komplikasi,diabetes
30,Kenapa Diabetes Disebut 'Mother of All Diseases'?,https://health.detik.com/diet/d-8338033/kenapa-diabetes-disebut-mother-of-all-diseases,diabetes
31,10 Buah Rendah Gula yang Aman untuk Diet dan Diabetes,https://food.detik.com/foto-kuliner/d-8154997/10-buah-rendah-gula-yang-aman-untuk-diet-dan-diabetes,diabetes
32,Golongan Darah Ini Disebut Paling Berisiko Idap Diabetes,https://health.detik.com/berita-detikhealth/d-8326700/golongan-darah-ini-disebut-paling-berisiko-idap-diabetes,diabetes
33,7 Camilan Aman dan Sehat untuk Pengidap Diabetes,https://health.detik.com/berita-detikhealth/d-8289698/7-camilan-aman-dan-sehat-untuk-pengidap-diabetes,diabetes
34,"Diabetes Jadi Penyebab Terbanyak Gagal Ginjal, Ini Wanti-wanti Para Dokter",https://health.detik.com/diet/d-8360939/diabetes-jadi-penyebab-terbanyak-gagal-ginjal-ini-wanti-wanti-para-dokter,diabetes
35,Duh! Menkes 'Sentil' Kebiasaan Warga +62 Pemicu Diabetes,https://health.detik.com/berita-detikhealth/d-8315201/duh-menkes-sentil-kebiasaan-warga-62-pemicu-diabetes,diabetes
36,Kenapa Penderita Diabetes Harus Diamputasi? Ini Penyebab dan Cara Mencegahnya,https://www.detik.com/jogja/berita/d-8302061/kenapa-penderita-diabetes-harus-diamputasi-ini-penyebab-dan-cara-mencegahnya,diabetes
37,Inovatif! 2 Siswi SMA Ini Bikin Tempe dari Biji Trembesi untuk Atasi Diabetes,https://www.detik.com/edu/edutainment/d-8394331/inovatif-2-siswi-sma-ini-bikin-tempe-dari-biji-trembesi-untuk-atasi-diabetes,diabetes
38,"Video: Pria Idap Diabetes Sejak Usia 16 Tahun, Kini Suntik Insulin Tiap Hari",https://health.detik.com/detiktv/d-8387929/video-pria-idap-diabetes-sejak-usia-16-tahun-kini-suntik-insulin-tiap-hari,diabetes
39,Video: Terbaring di RS Tak Memutus Keinginan Jaja Miharja untuk Terus Berkarya,https://20.detik.com/detikupdate/20250603-250603050/video-terbaring-di-rs-tak-memutus-keinginan-jaja-miharja-untuk-terus-berkarya,diabetes
40,Kebiasaan Warga Indonesia yang Jadi Pemicu Diabetes,https://www.detik.com/sumut/berita/d-8316443/kebiasaan-warga-indonesia-yang-jadi-pemicu-diabetes,diabetes
41,Tiap Hari 28 Warga Malaysia Kena Gagal Ginjal dan Harus Cuci Darah,https://health.detik.com/berita-detikhealth/d-8446419/tiap-hari-28-warga-malaysia-kena-gagal-ginjal-dan-harus-cuci-darah,diabetes
42,Diabetes dan Ancaman Tulang Keropos di Balik Kebiasaan Minum Serba Manis,https://health.detik.com/diet/d-8352148/diabetes-dan-ancaman-tulang-keropos-di-balik-kebiasaan-minum-serba-manis,diabetes
43,Gula Darah Tetap Stabil! 9 Buah Ini Aman Dikonsumsi Penderita Diabetes,https://food.detik.com/foto-kuliner/d-8114850/gula-darah-tetap-stabil-9-buah-ini-aman-dikonsumsi-penderita-diabetes,diabetes
44,"Menkes Warning Orang Gemuk, Berpotensi Kena Diabetes hingga Hipertensi",https://health.detik.com/berita-detikhealth/d-8314440/menkes-warning-orang-gemuk-berpotensi-kena-diabetes-hingga-hipertensi,diabetes
45,"Pemerintah Batasi Medsos untuk Anak, Bisa Cegah Hipertensi-Diabetes?",https://health.detik.com/berita-detikhealth/d-8427679/pemerintah-batasi-medsos-untuk-anak-bisa-cegah-hipertensi-diabetes,diabetes
46,"Ini Alasan Kebanyakan Gula Bisa Picu Diabetes, Sakit Jantung sampai Gagal Ginjal",https://health.detik.com/berita-detikhealth/d-8358711/ini-alasan-kebanyakan-gula-bisa-picu-diabetes-sakit-jantung-sampai-gagal-ginjal,diabetes
47,"10 Makanan Penurun Gula Darah, Cocok untuk Pengidap Diabetes",https://health.detik.com/berita-detikhealth/d-8282534/10-makanan-penurun-gula-darah-cocok-untuk-pengidap-diabetes,diabetes
48,BRIN Temukan Cemaran Obat Diabetes di Air DKI,https://health.detik.com/berita-detikhealth/d-8224230/brin-temukan-cemaran-obat-diabetes-di-air-dki,diabetes
49,Ancaman Komplikasi Diabetes di Balik Anggapan 'Boleh Gemuk Asal Sehat',https://health.detik.com/diet/d-8335714/ancaman-komplikasi-diabetes-di-balik-anggapan-boleh-gemuk-asal-sehat,diabetes
50,Diabetes Bisa Sembuh: Kabar Baik atau Hoax?,https://health.detik.com/berita-detikhealth/d-8209283/diabetes-bisa-sembuh-kabar-baik-atau-hoax,diabetes
51,Anti LEBAR-an setelah Lebaran Bareng Tropicana Slim!,https://20.detik.com/detikupdate/20250424-250424127/anti-lebar-an-setelah-lebaran-bareng-tropicana-slim,diabetes
52,"Kemenkes 'Upgrade' CKG di 2026, Pengobatan Diabetes-Hipertensi Gratis 15 Hari",https://health.detik.com/berita-detikhealth/d-8321812/kemenkes-upgrade-ckg-di-2026-pengobatan-diabetes-hipertensi-gratis-15-hari,diabetes
53,"Diabetes Mengintai, Sukabumi Perkuat Layanan Puskesmas",https://www.detik.com/jabar/berita/d-8214464/diabetes-mengintai-sukabumi-perkuat-layanan-puskesmas,diabetes
54,"Viral Tren 'Blue Matcha', Benarkah Lebih Aman untuk Diabetes?",https://health.detik.com/diet/d-8316886/viral-tren-blue-matcha-benarkah-lebih-aman-untuk-diabetes,diabetes
55,Foto: Transformasi Meghan Trainor Turun BB 27 Kg Pakai Obat Diabetes,https://wolipop.detik.com/foto-entertainment/d-8087056/foto-transformasi-meghan-trainor-turun-bb-27-kg-pakai-obat-diabetes,diabetes
56,"Beban Tersembunyi di Balik Diabetes, Saat Keluarga Ikut Berjuang",https://health.detik.com/berita-detikhealth/d-8209290/beban-tersembunyi-di-balik-diabetes-saat-keluarga-ikut-berjuang,diabetes
57,Hari Diabetes Sedunia 2025: Latar Belakang hingga Tema Tahun Ini,https://news.detik.com/berita/d-8210117/hari-diabetes-sedunia-2025-latar-belakang-hingga-tema-tahun-ini,diabetes
58,"Suplai Insulin Terhambat, Anak-anak Diabetes di Pengungsian Terancam Koma",https://health.detik.com/berita-detikhealth/d-8272864/suplai-insulin-terhambat-anak-anak-diabetes-di-pengungsian-terancam-koma,diabetes
59,"Angka Diabetes Melonjak di Turki, Tertinggi se-Eropa",https://news.detik.com/dw/d-8135835/angka-diabetes-melonjak-di-turki-tertinggi-se-eropa,diabetes
60,Keturunan vs Gaya Hidup: Mana yang Lebih Menentukan Risiko Diabetes?,https://health.detik.com/berita-detikhealth/d-8209297/keturunan-vs-gaya-hidup-mana-yang-lebih-menentukan-risiko-diabetes,diabetes
61,"WHO Soroti Harga Minuman Manis Murah, Warga Dunia Makin Rentan Kena Diabetes-Kanker",https://health.detik.com/berita-detikhealth/d-8322640/who-soroti-harga-minuman-manis-murah-warga-dunia-makin-rentan-kena-diabetes-kanker,diabetes
62,"Makan Buah Bikin Diabetes? Salah, Nggak Semua yang Manis Itu Jahat",https://health.detik.com/diet/d-8228778/makan-buah-bikin-diabetes-salah-nggak-semua-yang-manis-itu-jahat,diabetes
63,Faktor Utama Anak Muda Kena Gagal Ginjal,https://20.detik.com/detik-sore/20250312-250312124/faktor-utama-anak-muda-kena-gagal-ginjal,diabetes
64,"Komplikasi Diabetes Mengintai Diam-diam, Kenali Tandanya Sejak Dini!",https://www.detik.com/jatim/berita/d-8180364/komplikasi-diabetes-mengintai-diam-diam-kenali-tandanya-sejak-dini,diabetes
65,Catat! Ini 10 Tanda Awal Diabetes,https://www.detik.com/sumut/berita/d-8099358/catat-ini-10-tanda-awal-diabetes,diabetes
66,Temuan Mengejutkan: Basmi 'Sel Zombie' Bisa Jadi Kunci Atasi Diabetes,https://inet.detik.com/science/d-8226338/temuan-mengejutkan-basmi-sel-zombie-bisa-jadi-kunci-atasi-diabetes,diabetes
67,"Foto Boneka Barbie Edisi Pengidap Diabetes Tipe 1, Ada Pompa Insulinnya",https://health.detik.com/fotohealth/d-8007779/foto-boneka-barbie-edisi-pengidap-diabetes-tipe-1-ada-pompa-insulinnya,diabetes
68,Donna Agnesia Ungkap Pola Makan Keluarga Biar Bebas Risiko Diabetes,https://health.detik.com/berita-detikhealth/d-8213693/donna-agnesia-ungkap-pola-makan-keluarga-biar-bebas-risiko-diabetes,diabetes
69,Awas Diabetes! Ini Batas Konsumsi Gula yang Aman Menurut Kemenkes,https://health.detik.com/berita-detikhealth/d-8188588/awas-diabetes-ini-batas-konsumsi-gula-yang-aman-menurut-kemenkes,diabetes
70,Hari Diabetes Sedunia 14 November 2025: Tema dan Pesan Utamanya,https://news.detik.com/berita/d-8208630/hari-diabetes-sedunia-14-november-2025-tema-dan-pesan-utamanya,diabetes
71,"Tak Sekedar Kadar Gula Tinggi, Ini Deretan Komplikasi Fatal Diabetes",https://health.detik.com/berita-detikhealth/d-8180480/tak-sekedar-kadar-gula-tinggi-ini-deretan-komplikasi-fatal-diabetes,diabetes
72,Kabar Baik dari Ilmuwan Harvard! Ada Cara Baru Atasi Diabetes-Obesitas,https://health.detik.com/berita-detikhealth/d-8262571/kabar-baik-dari-ilmuwan-harvard-ada-cara-baru-atasi-diabetes-obesitas,diabetes
73,Sering Makan Mie Instan? Dokter Ungkap Fakta Soal Risiko Diabetes,https://food.detik.com/info-sehat/d-8180701/sering-makan-mie-instan-dokter-ungkap-fakta-soal-risiko-diabetes,diabetes
74,Mengapa Trump Bakal Tolak Orang Diabetes-Obesitas Masuk AS?,https://news.detik.com/internasional/d-8212920/mengapa-trump-bakal-tolak-orang-diabetes-obesitas-masuk-as,diabetes
75,Video: Emilia Contessa Meninggal Usai Idap Diabetes dan Gagal Jantung,https://20.detik.com/detikupdate/20250127-250127088/video-emilia-contessa-meninggal-usai-idap-diabetes-dan-gagal-jantung,diabetes
76,Perintah Baru Trump: Pemohon Visa yang Obesitas-Diabetes Bakal Ditolak,https://www.detik.com/kalimantan/berita/d-8211954/perintah-baru-trump-pemohon-visa-yang-obesitas-diabetes-bakal-ditolak,diabetes
77,"5 Tanda Tersembunyi saat Gula Darah Tak Terkontrol, Waspada kena Diabetes",https://health.detik.com/berita-detikhealth/d-8212772/5-tanda-tersembunyi-saat-gula-darah-tak-terkontrol-waspada-kena-diabetes,diabetes
78,"Ancaman Gula Berlebih: Manis Sesaat, Diabetes Sepanjang Hayat",https://health.detik.com/berita-detikhealth/d-8185504/ancaman-gula-berlebih-manis-sesaat-diabetes-sepanjang-hayat,diabetes
79,Keseruan Poundfit #BeatDiabetes Tropicana Slim Bareng Donna Agnesia,https://health.detik.com/fotohealth/d-7866772/keseruan-poundfit-beatdiabetes-tropicana-slim-bareng-donna-agnesia,diabetes
80,Amerika Serikat Tolak Pemohon Visa yang Obesitas dan Diabetes,https://www.detik.com/jabar/berita/d-8211947/amerika-serikat-tolak-pemohon-visa-yang-obesitas-dan-diabetes,diabetes
81,"Fakta-fakta Wanita Asal Surabaya Idap Diabetes Tipe 1,5 di Usia 29",https://health.detik.com/diet/d-8276675/fakta-fakta-wanita-asal-surabaya-idap-diabetes-tipe-1-5-di-usia-29,diabetes
82,Gula Darah Sering Naik-Turun? Produk Ini Bisa Bantu Penderita Diabetes,https://health.detik.com/berita-detikhealth/d-8192081/gula-darah-sering-naik-turun-produk-ini-bisa-bantu-penderita-diabetes,diabetes
83,"Jangan Abaikan Penyakit Diabetes, Dokter Ungkap Komplikasi Serius yang Bisa Menyertai",https://health.detik.com/berita-detikhealth/d-8188580/jangan-abaikan-penyakit-diabetes-dokter-ungkap-komplikasi-serius-yang-bisa-menyertai,diabetes
84,"Cerita Wanita Surabaya Idap Diabetes di Usia 29, Inikah Pemicunya?",https://health.detik.com/berita-detikhealth/d-8269324/cerita-wanita-surabaya-idap-diabetes-di-usia-29-inikah-pemicunya,diabetes
85,Sering Ngantuk Meski Tidur Cukup? Hati-hati Diabetes,https://health.detik.com/berita-detikhealth/d-8063663/sering-ngantuk-meski-tidur-cukup-hati-hati-diabetes,diabetes
86,"Diabetes Tak Selalu Bergejala, Ini Saran Dokter Buat yang Doyan Manis",https://health.detik.com/berita-detikhealth/d-8188008/diabetes-tak-selalu-bergejala-ini-saran-dokter-buat-yang-doyan-manis,diabetes
87,Video: Ibnu Jamil Ungkap Ibundanya Memiliki Riwayat Penyakit Diabetes,https://20.detik.com/detikupdate/20250115-250115109/video-ibnu-jamil-ungkap-ibundanya-memiliki-riwayat-penyakit-diabetes,diabetes
88,"Dewasa Muda Kena Diabetes Makin Marak, Beban BPJS Kesehatan Makin Berat",https://www.detik.com/kalimantan/berita/d-8180507/dewasa-muda-kena-diabetes-makin-marak-beban-bpjs-kesehatan-makin-berat,diabetes
89,Alasan Trump Perketat Aturan Visa Bagi Pemohon yang Obesitas hingga Diabetes,https://health.detik.com/berita-detikhealth/d-8212433/alasan-trump-perketat-aturan-visa-bagi-pemohon-yang-obesitas-hingga-diabetes,diabetes
90,Kenapa Pengidap Diabetes Tak Disarankan Minum Jus Buah?,https://www.detik.com/sumut/berita/d-8214368/kenapa-pengidap-diabetes-tak-disarankan-minum-jus-buah,diabetes
91,Begini Prinsip Penanganan Diabetes dan Hubungannya Terhadap Syaraf,https://health.detik.com/fotohealth/d-7197509/begini-prinsip-penanganan-diabetes-dan-hubungannya-terhadap-syaraf,diabetes
92,"Kemenkes Bicara Kebiasaan Minum Manis Warga +62, Penyumbang 30 Persen Kasus Diabetes",https://health.detik.com/berita-detikhealth/d-8188591/kemenkes-bicara-kebiasaan-minum-manis-warga-62-penyumbang-30-persen-kasus-diabetes,diabetes
93,Wamenkes Soroti Obat Bahan Alam RI yang Bisa untuk Pasien Stroke-Diabetes,https://health.detik.com/berita-detikhealth/d-8255509/wamenkes-soroti-obat-bahan-alam-ri-yang-bisa-untuk-pasien-stroke-diabetes,diabetes
94,"Gaya Hidup Manis Picu Diabetes Dini, Ini Ciri-cirinya",https://www.detik.com/jatim/berita/d-8063649/gaya-hidup-manis-picu-diabetes-dini-ini-ciri-cirinya,diabetes
95,"Video: Cerita Dibalik Nama Unik Anak Anne-Marie, Terinspirasi dari Diabetes",https://20.detik.com/detikupdate/20251018-251018040/video-cerita-dibalik-nama-unik-anak-anne-marie-terinspirasi-dari-diabetes,diabetes
96,Yang Diabetes hingga Obesitas Ditolak Trump Masuk ke AS,https://news.detik.com/internasional/d-8212553/yang-diabetes-hingga-obesitas-ditolak-trump-masuk-ke-as,diabetes
97,Gatal-gatal Nggak Sembuh? Mungkin Bukan Penyakit Kulit tapi Kena Diabetes,https://health.detik.com/berita-detikhealth/d-8213273/gatal-gatal-nggak-sembuh-mungkin-bukan-penyakit-kulit-tapi-kena-diabetes,diabetes
98,Awas Ini 7 Pantangan Makanan dan Minuman Bagi Penderita Diabetes!,https://www.detik.com/sumut/berita/d-8250979/awas-ini-7-pantangan-makanan-dan-minuman-bagi-penderita-diabetes,diabetes
99,Peringatan Hari Diabetes Sedunia: Langkah Sehat Bersama Tropicana Slim,https://20.detik.com/special-coverage/20241126-241126074/peringatan-hari-diabetes-sedunia-langkah-sehat-bersama-tropicana-slim,diabetes
100,"Kemenkes Soroti Lingkungan 'Obesogenik', Bikin Gen Z Gampang Kena Diabetes!",https://health.detik.com/berita-detikhealth/d-8188182/kemenkes-soroti-lingkungan-obesogenik-bikin-gen-z-gampang-kena-diabetes,diabetes
101,"Cerita Cipa, Idap Diabetes di Usia 29 Tahun Akibat Gaya Hidup",https://www.detik.com/jabar/berita/d-8269448/cerita-cipa-idap-diabetes-di-usia-29-tahun-akibat-gaya-hidup,diabetes
102,"Pasien Diabetes Makin Muda, Dokter Wanti-wanti Gen Z yang Doyan Jajan Manis",https://health.detik.com/berita-detikhealth/d-8187683/pasien-diabetes-makin-muda-dokter-wanti-wanti-gen-z-yang-doyan-jajan-manis,diabetes
103,Yuk! Cegah Diabetes Sejak Dini,https://health.detik.com/fotohealth/d-7144697/yuk-cegah-diabetes-sejak-dini,diabetes
104,Bolehkah Penderita Diabetes Makan Buah? Simak Fakta dan Tipsnya,https://health.detik.com/berita-detikhealth/d-8108877/bolehkah-penderita-diabetes-makan-buah-simak-fakta-dan-tipsnya,diabetes
105,"Anak Muda Ternyata Tetap Bisa Terkena Diabetes, Begini Cara Cegahnya",https://health.detik.com/berita-detikhealth/d-8124850/anak-muda-ternyata-tetap-bisa-terkena-diabetes-begini-cara-cegahnya,diabetes
106,"Gaya Hidup vs Genetik, Dokter Jelaskan Mana yang Lebih Berperan Picu Diabetes",https://health.detik.com/berita-detikhealth/d-8214960/gaya-hidup-vs-genetik-dokter-jelaskan-mana-yang-lebih-berperan-picu-diabetes,diabetes
107,"Rutin Cek Gula Darah, Upaya Sederhana Jaga Tubuh dari Diabetes",https://health.detik.com/berita-detikhealth/d-8120876/rutin-cek-gula-darah-upaya-sederhana-jaga-tubuh-dari-diabetes,diabetes
108,Apakah Pengidap Diabetes Boleh Konsumsi Mangga? Begini Penjelasan Studi,https://health.detik.com/berita-detikhealth/d-8170190/apakah-pengidap-diabetes-boleh-konsumsi-mangga-begini-penjelasan-studi,diabetes
109,Maestro Dalang Ki Anom Suroto Wafat Akibat Serangan Jantung-Diabetes,https://www.detik.com/jatim/budaya/d-8174244/maestro-dalang-ki-anom-suroto-wafat-akibat-serangan-jantung-diabetes,diabetes
110,"Cerita Wanita Surabaya Tak Sadar Kena Diabetes di Usia 29, Doyan Jajanan Viral",https://health.detik.com/berita-detikhealth/d-8269680/cerita-wanita-surabaya-tak-sadar-kena-diabetes-di-usia-29-doyan-jajanan-viral,diabetes
111,Video: Pengidap Diabetes Dianjurkan Olahraga 150 Menit per Minggu,https://20.detik.com/detikupdate/20241123-241123074/video-pengidap-diabetes-dianjurkan-olahraga-150-menit-per-minggu,diabetes
112,"FDA Wanti-wanti Risiko Salah Baca Alat Monitor Gula Darah, 7 Pasien Diabetes Meninggal",https://health.detik.com/berita-detikhealth/d-8247783/fda-wanti-wanti-risiko-salah-baca-alat-monitor-gula-darah-7-pasien-diabetes-meninggal,diabetes
113,7 Perubahan Pada Tubuh yang Menjadi 'Sinyal' Tanda Awal Diabetes,https://health.detik.com/berita-detikhealth/d-8154755/7-perubahan-pada-tubuh-yang-menjadi-sinyal-tanda-awal-diabetes,diabetes
114,Hati-hati! Dokter Bilang Kebiasaan Tidur Seperti Ini Bisa Tingkatkan Risiko Diabetes,https://health.detik.com/berita-detikhealth/d-8217293/hati-hati-dokter-bilang-kebiasaan-tidur-seperti-ini-bisa-tingkatkan-risiko-diabetes,diabetes
115,Minuman Berpemanis Bakal Kena Cukai Demi Cegah Prevalensi Diabetes,https://finance.detik.com/foto-bisnis/d-7090319/minuman-berpemanis-bakal-kena-cukai-demi-cegah-prevalensi-diabetes,diabetes
116,Dokter Mayapada Hospital Siaga 24 Jam Tangani Komplikasi Akut Diabetes,https://health.detik.com/berita-detikhealth/d-8126776/dokter-mayapada-hospital-siaga-24-jam-tangani-komplikasi-akut-diabetes,diabetes
117,Apakah Air Kelapa Boleh Dikonsumsi Pengidap Diabetes?,https://health.detik.com/berita-detikhealth/d-8078951/apakah-air-kelapa-boleh-dikonsumsi-pengidap-diabetes,diabetes
118,Alert! Wamenkes Soroti Makin Banyak Anak Muda di Bawah Umur 20-an Kena Diabetes,https://health.detik.com/berita-detikhealth/d-8221664/alert-wamenkes-soroti-makin-banyak-anak-muda-di-bawah-umur-20-an-kena-diabetes,diabetes
119,Dinkes Sebut Siswi SD di Lubuklinggau Terindikasi Diabetes Kembali Normal,https://www.detik.com/sumbagsel/berita/d-8096659/dinkes-sebut-siswi-sd-di-lubuklinggau-terindikasi-diabetes-kembali-normal,diabetes
120,"Penyakit Diabetes Hantui Anak Muda, Ini Ciri & Cara Cegahnya",https://health.detik.com/berita-detikhealth/d-8063645/penyakit-diabetes-hantui-anak-muda-ini-ciri-cara-cegahnya,diabetes
121,5 Sayuran Penurun Gula Darah yang Aman untuk Pengidap Diabetes,https://www.detik.com/jabar/kuliner/d-8211856/5-sayuran-penurun-gula-darah-yang-aman-untuk-pengidap-diabetes,diabetes
122,"Gatal Bisa Jadi Salah Satu Gejala Diabetes, Seperti Ini Ciri-cirinya",https://health.detik.com/berita-detikhealth/d-8194364/gatal-bisa-jadi-salah-satu-gejala-diabetes-seperti-ini-ciri-cirinya,diabetes
123,Video: Indonesia Jadi Negara Kelima di Dunia dengan Pasien Diabetes Terbanyak,https://20.detik.com/detikupdate/20241122-241122109/video-indonesia-jadi-negara-kelima-di-dunia-dengan-pasien-diabetes-terbanyak,diabetes
124,"Nikmat Sesaat, Bahaya Seumur Hidup: Awas Diabetes Mengintai!",https://health.detik.com/berita-detikhealth/d-8015548/nikmat-sesaat-bahaya-seumur-hidup-awas-diabetes-mengintai,diabetes
125,"Kronologi Wanita Surabaya Idap Diabetes di Usia 29 Tahun, Sempat Koma 12 Hari",https://health.detik.com/berita-detikhealth/d-8269901/kronologi-wanita-surabaya-idap-diabetes-di-usia-29-tahun-sempat-koma-12-hari,diabetes
126,"Siasat BPOM Bantu Tekan Angka Diabetes di Indonesia, Siapkan Label Nutri-Level",https://health.detik.com/berita-detikhealth/d-8188098/siasat-bpom-bantu-tekan-angka-diabetes-di-indonesia-siapkan-label-nutri-level,diabetes
127,Infografis: Herbal Antiobesitas-Antidiabetes Hasil Riset Profesor IPB,https://www.detik.com/edu/foto/d-7014166/infografis-herbal-antiobesitas-antidiabetes-hasil-riset-profesor-ipb,diabetes
128,"Minuman Kayu Manis, Berkhasiat Pereda Diabetes hingga Potensi Antikanker",https://www.detik.com/sumbagsel/kuliner/d-8160728/minuman-kayu-manis-berkhasiat-pereda-diabetes-hingga-potensi-antikanker,diabetes
129,Dokter Ungkap Cara Tubuh Memproses Gula hingga Tingkatkan Risiko Diabetes,https://health.detik.com/berita-detikhealth/d-8064094/dokter-ungkap-cara-tubuh-memproses-gula-hingga-tingkatkan-risiko-diabetes,diabetes
130,"BPJS Kesehatan Beri Warning Gagal Ginjal 'Meroket' di RI, Pembiayaan Naik 400 Persen!",https://health.detik.com/berita-detikhealth/d-8445566/bpjs-kesehatan-beri-warning-gagal-ginjal-meroket-di-ri-pembiayaan-naik-400-persen,diabetes
131,"Tak Terasa Tapi Bahaya, Kenali Penyebab Diabetes Sebelum Terlambat",https://health.detik.com/berita-detikhealth/d-8015588/tak-terasa-tapi-bahaya-kenali-penyebab-diabetes-sebelum-terlambat,diabetes
