,title,link,keyword
925,Food Vlogger Bikin Warung Rawon Tutup hingga Nasi Dingin Lebih Sehat,https://food.detik.com/berita-boga/d-7569562/food-vlogger-bikin-warung-rawon-tutup-hingga-nasi-dingin-lebih-sehat,diabetes
926,Mengenal Jenis Gula dan Bahayanya Jika Dikonsumsi Berlebih,https://www.detik.com/jabar/kuliner/d-8439712/mengenal-jenis-gula-dan-bahayanya-jika-dikonsumsi-berlebih,diabetes
927,Hati-hati! Kombinasi Durian dengan 5 Makanan Ini Tidak Dianjurkan,https://food.detik.com/info-sehat/d-8400991/hati-hati-kombinasi-durian-dengan-5-makanan-ini-tidak-dianjurkan,diabetes
928,"Waspadai Kanker Ginjal, Pola Makan Seperti Ini Bisa Tingkatkan Risiko",https://health.detik.com/diet/d-8394117/waspadai-kanker-ginjal-pola-makan-seperti-ini-bisa-tingkatkan-risiko,diabetes
929,2 Makanan Wajib Dikonsumsi saat Puasa Biar Nggak Lemas Menurut Profesor Gizi IPB,https://health.detik.com/berita-detikhealth/d-8366855/2-makanan-wajib-dikonsumsi-saat-puasa-biar-nggak-lemas-menurut-profesor-gizi-ipb,diabetes
930,2 Makanan Wajib Dikonsumsi saat Puasa Biar Nggak Lemas Menurut Profesor Gizi IPB,https://health.detik.com/berita-detikhealth/d-8366855/2-makanan-wajib-dikonsumsi-saat-puasa-biar-nggak-lemas-menurut-profesor-gizi-ipb,diabetes
931,"Temuan Peneliti, Secangkir Kopi Bisa Bantu Kendalikan Gula Darah",https://health.detik.com/berita-detikhealth/d-8306043/temuan-peneliti-secangkir-kopi-bisa-bantu-kendalikan-gula-darah,diabetes
932,"Marak Kasus Cuci Darah pada Anak, Mahasiswa Polines Bikin Inovasi Ini",https://www.detik.com/edu/edutainment/d-7483368/marak-kasus-cuci-darah-pada-anak-mahasiswa-polines-bikin-inovasi-ini,diabetes
933,Sang Anak Ungkap Detik-detik Meninggalnya Omas,https://20.detik.com/e-flash/20200717-200717016/sang-anak-ungkap-detik-detik-meninggalnya-omas,diabetes
934,Waspada! Ini 5 Efek Samping Kebanyakan Makan Nasi Putih,https://food.detik.com/info-sehat/d-7453264/waspada-ini-5-efek-samping-kebanyakan-makan-nasi-putih,diabetes
935,Aktivitas Fisik yang Disarankan untuk Penderita Diabetes,https://www.detik.com/sumut/berita/d-7358716/aktivitas-fisik-yang-disarankan-untuk-penderita-diabetes,diabetes
936,"Mengkhawatirkan, IDAI Ungkap Anak 6 Tahun Kena Diabetes gegara Kebiasaan Ini",https://health.detik.com/berita-detikhealth/d-7363462/mengkhawatirkan-idai-ungkap-anak-6-tahun-kena-diabetes-gegara-kebiasaan-ini,diabetes
937,5 Penyakit yang Bisa Dideteksi Lewat Medical Check Up,https://health.detik.com/berita-detikhealth/d-8333967/5-penyakit-yang-bisa-dideteksi-lewat-medical-check-up,diabetes
938,"Viral Bocil-bocil ke RSCM Cuci Darah, Survei IDAI: 1 dari 5 Anak Berpotensi Gagal Ginjal",https://health.detik.com/berita-detikhealth/d-7454322/viral-bocil-bocil-ke-rscm-cuci-darah-survei-idai-1-dari-5-anak-berpotensi-gagal-ginjal,diabetes
939,"Orang dengan Kondisi Ini Sebaiknya Tak Konsumsi Nanas, Begini Dampaknya ke Tubuh",https://health.detik.com/berita-detikhealth/d-7492184/orang-dengan-kondisi-ini-sebaiknya-tak-konsumsi-nanas-begini-dampaknya-ke-tubuh,diabetes
940,"Kasus Gagal Ginjal Ngegas Juga di RI, Makin Banyak Warga +62 Cuci Darah",https://health.detik.com/berita-detikhealth/d-8444789/kasus-gagal-ginjal-ngegas-juga-di-ri-makin-banyak-warga-62-cuci-darah,diabetes
941,Pakar Teliti Campuran Kayu Manis dan Bungur untuk Fitofarmaka Antidiabetes,https://health.detik.com/berita-detikhealth/d-8323277/pakar-teliti-campuran-kayu-manis-dan-bungur-untuk-fitofarmaka-antidiabetes,diabetes
942,"5 Makanan dan Minuman Pantangan Saat Makan Durian, Jangan Sembarangan Ya!",https://food.detik.com/info-sehat/d-8335994/5-makanan-dan-minuman-pantangan-saat-makan-durian-jangan-sembarangan-ya,diabetes
943,"Sering Dicap Buruk, 5 Minuman Ini Ternyata Bermanfaat untuk Kesehatan",https://food.detik.com/info-sehat/d-8339439/sering-dicap-buruk-5-minuman-ini-ternyata-bermanfaat-untuk-kesehatan,diabetes
944,"Beras Sehat, Ramah Diabetes Malaysia",https://20.detik.com/spot-wisata/20200331-200331086/beras-sehat-ramah-diabetes-malaysia,diabetes
945,Dokter Ungkap Pola Makan Gen Z yang Diam-diam Bikin Gagal Ginjal,https://health.detik.com/berita-detikhealth/d-8396093/dokter-ungkap-pola-makan-gen-z-yang-diam-diam-bikin-gagal-ginjal,diabetes
946,Pakar Wanti-wanti soal Serangan Jantung 'Diam-diam',https://www.detik.com/jabar/berita/d-8356136/pakar-wanti-wanti-soal-serangan-jantung-diam-diam,diabetes
947,Minuman Elektrolit Apakah Perlu Dikonsumsi saat Berbuka? Ini Kata Ahli Gizi,https://www.detik.com/sumut/berita/d-8368773/minuman-elektrolit-apakah-perlu-dikonsumsi-saat-berbuka-ini-kata-ahli-gizi,diabetes
948,Iklan Pangan Siap Saji Tinggi Gula Resmi Dilarang,https://www.detik.com/sumut/berita/d-7464009/iklan-pangan-siap-saji-tinggi-gula-resmi-dilarang,diabetes
949,Inspiratif! Prof Prima Jadi Guru Besar Disabilitas Pertama di Unesa,https://www.detik.com/jatim/berita/d-8350378/inspiratif-prof-prima-jadi-guru-besar-disabilitas-pertama-di-unesa,diabetes
950,Ternyata Kurma Ada yang Ditambah Sirup Glukosa?,https://health.detik.com/diet/d-8372522/ternyata-kurma-ada-yang-ditambah-sirup-glukosa,diabetes
951,Idap Penyakit Ini Jadi Motivasi Meghan Trainor Pangkas BB sampai 27 Kg,https://health.detik.com/diet/d-8222221/idap-penyakit-ini-jadi-motivasi-meghan-trainor-pangkas-bb-sampai-27-kg,diabetes
952,Rekomendasi Dokter soal Aktivitas Fisik untuk Pasien Diabetes,https://20.detik.com/detikupdate/20240526-240526112/rekomendasi-dokter-soal-aktivitas-fisik-untuk-pasien-diabetes,diabetes
953,Inspiratif! Prof Prima Jadi Guru Besar Disabilitas Pertama di Unesa,https://www.detik.com/jatim/berita/d-8350378/inspiratif-prof-prima-jadi-guru-besar-disabilitas-pertama-di-unesa,diabetes
954,Ternyata Kurma Ada yang Ditambah Sirup Glukosa?,https://health.detik.com/diet/d-8372522/ternyata-kurma-ada-yang-ditambah-sirup-glukosa,diabetes
955,Cinta Penelope dan Suami Berjuang Lawan Kanker dan Diabetes,https://20.detik.com/e-flash/20200313-200313051/cinta-penelope-dan-suami-berjuang-lawan-kanker-dan-diabetes,diabetes
956,Khasiat Kumis Kucing hingga Temulawak untuk Atasi Diabetes,https://health.detik.com/detiktv/d-7358284/khasiat-kumis-kucing-hingga-temulawak-untuk-atasi-diabetes,diabetes
957,Ahli Ungkap 2 Gejala 'Silent Heart Attack' yang Sering Diabaikan,https://health.detik.com/berita-detikhealth/d-8347777/ahli-ungkap-2-gejala-silent-heart-attack-yang-sering-diabaikan,diabetes
958,Kampanye #Hands4Diabetes 2025 Tropicana Slim Ajak Hidup Sehat Produktif,https://health.detik.com/advertorial-news-block/d-8210330/kampanye-hands4diabetes-2025-tropicana-slim-ajak-hidup-sehat-produktif,diabetes
959,"Kebanyakan Minum Milk Tea, Ini 7 Efek Samping untuk Tubuh",https://www.detik.com/sumut/berita/d-8432337/kebanyakan-minum-milk-tea-ini-7-efek-samping-untuk-tubuh,diabetes
960,"Bangun Mepet Imsak, Terpaksa Sahur Makan Mi Instan? Ini Saran Dokter Gizi",https://health.detik.com/berita-detikhealth/d-8384593/bangun-mepet-imsak-terpaksa-sahur-makan-mi-instan-ini-saran-dokter-gizi,diabetes
961,"BPOM Sudah Beri Lampu Hijau, Kapan 'Nutri Level' Diterapkan?",https://health.detik.com/berita-detikhealth/d-8434830/bpom-sudah-beri-lampu-hijau-kapan-nutri-level-diterapkan,diabetes
962,"Bukan Kopi, Ternyata Cara Ini Lebih Ampuh Usir Rasa Ngantuk saat Kerja",https://health.detik.com/berita-detikhealth/d-8323938/bukan-kopi-ternyata-cara-ini-lebih-ampuh-usir-rasa-ngantuk-saat-kerja,diabetes
963,"Kasus TB di RI Tembus 1 Juta, Banyak Pasien Tak Sadar Terinfeksi",https://health.detik.com/berita-detikhealth/d-8435377/kasus-tb-di-ri-tembus-1-juta-banyak-pasien-tak-sadar-terinfeksi,diabetes
964,"Terobosan Baru Ilmuwan China, Pakai Stem Cell untuk Sembuhkan Pasien Diabetes",https://health.detik.com/berita-detikhealth/d-7363641/terobosan-baru-ilmuwan-china-pakai-stem-cell-untuk-sembuhkan-pasien-diabetes,diabetes
965,Ahli Gizi Dukung Kebijakan Pemerintah yang Mengatur Pangan Olahan,https://www.detik.com/jatim/berita/d-7471108/ahli-gizi-dukung-kebijakan-pemerintah-yang-mengatur-pangan-olahan,diabetes
966,Penjelasan Medis yang Terjadi Pada Tubuh saat Puasa Ramadan,https://health.detik.com/berita-detikhealth/d-8359823/penjelasan-medis-yang-terjadi-pada-tubuh-saat-puasa-ramadan,diabetes
967,"Kasus Gagal Ginjal 'Meledak' di Malaysia, Inikah Pemicunya?",https://health.detik.com/berita-detikhealth/d-8444018/kasus-gagal-ginjal-meledak-di-malaysia-inikah-pemicunya,diabetes
968,"5 Khasiat Sehat Minum Air Kelapa, Sehatkan Tulang dan Cegah Diabetes",https://food.detik.com/info-sehat/d-7406166/5-khasiat-sehat-minum-air-kelapa-sehatkan-tulang-dan-cegah-diabetes,diabetes
969,Manfaat Daun Kelor untuk Berbagai Jenis Penyakit,https://health.detik.com/berita-detikhealth/d-8315778/manfaat-daun-kelor-untuk-berbagai-jenis-penyakit,diabetes
970,Catat! Ini 12 Makanan dan Minuman yang Bisa Merusak Ginjal,https://www.detik.com/sumbagsel/kuliner/d-8440540/catat-ini-12-makanan-dan-minuman-yang-bisa-merusak-ginjal,diabetes
971,"Biar Sehat Maksimal, Begini Cara Makan Greek Yogurt yang Tepat",https://food.detik.com/info-sehat/d-8443653/biar-sehat-maksimal-begini-cara-makan-greek-yogurt-yang-tepat,diabetes
972,Kandungan Probiotik Susu Fermentasi Bisa Jadi Alternatif Cegah Diabetes,https://health.detik.com/berita-detikhealth/d-7359166/kandungan-probiotik-susu-fermentasi-bisa-jadi-alternatif-cegah-diabetes,diabetes
973,"Biar Sehat Maksimal, Begini Cara Makan Greek Yogurt yang Tepat",https://food.detik.com/info-sehat/d-8443653/biar-sehat-maksimal-begini-cara-makan-greek-yogurt-yang-tepat,diabetes
974,"Cara Efektif Lawan Ngantuk Saat Kerja, Bukan dengan Kopi",https://www.detik.com/jabar/kuliner/d-8324149/cara-efektif-lawan-ngantuk-saat-kerja-bukan-dengan-kopi,diabetes
975,Menkes Wanti-wanti Jenis Minuman yang Picu Kerusakan Ginjal,https://health.detik.com/berita-detikhealth/d-8323427/menkes-wanti-wanti-jenis-minuman-yang-picu-kerusakan-ginjal,diabetes
976,8 Kebiasaan Buruk Saat Puasa yang Diam-diam Bikin Berat Badan Naik,https://wolipop.detik.com/health-and-diet/d-8367021/8-kebiasaan-buruk-saat-puasa-yang-diam-diam-bikin-berat-badan-naik,diabetes
977,"3 Makanan Terbaik untuk Jadi Topping Greek Yogurt, Bikin Lebih Bergizi",https://wolipop.detik.com/health-and-diet/d-8443966/3-makanan-terbaik-untuk-jadi-topping-greek-yogurt-bikin-lebih-bergizi,diabetes
978,"Sederet Sayuran yang Bisa Tekan Gula Darah Tinggi, Yuk Disimak!",https://www.detik.com/sumut/berita/d-8197833/sederet-sayuran-yang-bisa-tekan-gula-darah-tinggi-yuk-disimak,diabetes
979,9 Penyebab Memar Tanpa Sebab dan Cara Mengatasinya yang Bisa Dilakukan di Rumah,https://www.detik.com/jogja/berita/d-8330138/9-penyebab-memar-tanpa-sebab-dan-cara-mengatasinya-yang-bisa-dilakukan-di-rumah,diabetes
980,Hati-hati! 7 Hal Ini Bisa Bikin Otak Cepat 'Menciut' hingga Demensia Usia Muda,https://health.detik.com/berita-detikhealth/d-8361752/hati-hati-7-hal-ini-bisa-bikin-otak-cepat-menciut-hingga-demensia-usia-muda,diabetes
981,"Kesal Diabetesnya Dianggap Sepele, Istri Suntik Mati Suami Pakai Insulin",https://health.detik.com/true-story/d-7430840/kesal-diabetesnya-dianggap-sepele-istri-suntik-mati-suami-pakai-insulin,diabetes
982,"Pria Ini Alami Penurunan Fungsi Ginjal di Usia 39, Begini Gejala Awalnya",https://health.detik.com/berita-detikhealth/d-8246789/pria-ini-alami-penurunan-fungsi-ginjal-di-usia-39-begini-gejala-awalnya,diabetes
983,"Kasus TBC Sumsel 2025 Capai 24.748, Dinkes Perkuat Kolaborasi Lintas Sektor",https://www.detik.com/sumbagsel/berita/d-8435189/kasus-tbc-sumsel-2025-capai-24-748-dinkes-perkuat-kolaborasi-lintas-sektor,diabetes
984,3 Kebiasaan untuk Gen Z yang Membantu Menjaga Kesehatan,https://www.detik.com/sumut/berita/d-8324031/3-kebiasaan-untuk-gen-z-yang-membantu-menjaga-kesehatan,diabetes
985,"Minuman Manis VS Rokok, Lebih Berbahaya Mana? Pakar Ungkap Faktanya",https://www.detik.com/edu/detikpedia/d-7478386/minuman-manis-vs-rokok-lebih-berbahaya-mana-pakar-ungkap-faktanya,diabetes
986,Tanggal 14 November 2025 Memperingati Hari Apa? Ada 5 Momen Menarik!,https://www.detik.com/jogja/berita/d-8209943/tanggal-14-november-2025-memperingati-hari-apa-ada-5-momen-menarik,diabetes
987,"Teliti Penyakit Buah Zakar, Alumni FK Unair Raih PhD Kurang dari 4 Tahun",https://www.detik.com/jatim/berita/d-8365198/teliti-penyakit-buah-zakar-alumni-fk-unair-raih-phd-kurang-dari-4-tahun,diabetes
988,"BB Berlebih Jangan Disepelekan, Studi Buktikan Obesitas Picu 61 Penyakit Kronis",https://health.detik.com/berita-detikhealth/d-8343150/bb-berlebih-jangan-disepelekan-studi-buktikan-obesitas-picu-61-penyakit-kronis,diabetes
989,"Hati-hati, Ini yang Terjadi Jika Kalap Makan Enak Berlanjut Setelah Lebaran",https://health.detik.com/diet/d-8410301/hati-hati-ini-yang-terjadi-jika-kalap-makan-enak-berlanjut-setelah-lebaran,diabetes
990,"Sering Dijadikan Bubur, Ini 5 Manfaat Sehat Konsumsi Kacang Hijau",https://food.detik.com/info-sehat/d-8403629/sering-dijadikan-bubur-ini-5-manfaat-sehat-konsumsi-kacang-hijau,diabetes
991,"Purbaya Tunda Cukai MBDK, Pakar Sentil Konsumsi Minum Manis RI Sudah Mengkhawatirkan",https://health.detik.com/berita-detikhealth/d-8264796/purbaya-tunda-cukai-mbdk-pakar-sentil-konsumsi-minum-manis-ri-sudah-mengkhawatirkan,diabetes
992,Stop Gula Darah Naik Turun! Coba 5 Minuman Antiinflamasi dari Ahli Gizi,https://food.detik.com/info-sehat/d-8169328/stop-gula-darah-naik-turun-coba-5-minuman-antiinflamasi-dari-ahli-gizi,diabetes
993,Stop Gula Darah Naik Turun! Coba 5 Minuman Antiinflamasi dari Ahli Gizi,https://food.detik.com/info-sehat/d-8169328/stop-gula-darah-naik-turun-coba-5-minuman-antiinflamasi-dari-ahli-gizi,diabetes
994,Tanggal 14 November Memperingati Hari Apa? Ada HUT ke-80 Brimob,https://www.detik.com/sulsel/berita/d-8209766/tanggal-14-november-memperingati-hari-apa-ada-hut-ke-80-brimob,diabetes
995,"Bukan Mitos, Dosen Unair Bilang Kurang Tidur Bisa Picu Penyakit Ini pada Remaja",https://www.detik.com/edu/detikpedia/d-8299675/bukan-mitos-dosen-unair-bilang-kurang-tidur-bisa-picu-penyakit-ini-pada-remaja,diabetes
996,"BB Pernah 150 Kg, Saykoji Beberkan Momen Melek Hidup Sehat",https://hot.detik.com/celeb/d-8225469/bb-pernah-150-kg-saykoji-beberkan-momen-melek-hidup-sehat,diabetes
997,"7 Penyebab Luka Tak Kunjung Sembuh, Awas Diabetes!",https://www.detik.com/bali/berita/d-7388668/7-penyebab-luka-tak-kunjung-sembuh-awas-diabetes,diabetes
998,"El Nino 'Godzilla' OTW RI, Suhu Panas Ekstrem yang Bisa Picu Masalah Kesehatan",https://health.detik.com/berita-detikhealth/d-8439740/el-nino-godzilla-otw-ri-suhu-panas-ekstrem-yang-bisa-picu-masalah-kesehatan,diabetes
999,"7 Khasiat Jeruk Nipis, Perkuat Imun hingga Cerahkan Kulit",https://www.detik.com/sumbagsel/kuliner/d-8329288/7-khasiat-jeruk-nipis-perkuat-imun-hingga-cerahkan-kulit,diabetes
1000,Ngeri! Jenis Makanan Ini Disebut Lebih Mematikan dari Rokok,https://food.detik.com/info-sehat/d-8434234/ngeri-jenis-makanan-ini-disebut-lebih-mematikan-dari-rokok,diabetes
1001,Masih Ragu Konsumsi Minyak Zaitun? 5 Khasiat Ini Sayang Dilewatkan,https://food.detik.com/info-sehat/d-8305498/masih-ragu-konsumsi-minyak-zaitun-5-khasiat-ini-sayang-dilewatkan,diabetes
1002,"1 Orang Meninggal Tiap 4 Menit, Wamenkes Soroti Banyak Kasus TBC Belum Ditemukan",https://health.detik.com/berita-detikhealth/d-8433276/1-orang-meninggal-tiap-4-menit-wamenkes-soroti-banyak-kasus-tbc-belum-ditemukan,diabetes
1003,"7 Buah Enak yang Bisa Jaga Kesehatan Ginjal, Ini Daftarnya",https://health.detik.com/berita-detikhealth/d-8300307/7-buah-enak-yang-bisa-jaga-kesehatan-ginjal-ini-daftarnya,diabetes
1004,Ini Waktu Terbaik Minum Teh Bunga Telang dan Deretan Manfaatnya,https://health.detik.com/berita-detikhealth/d-8314907/ini-waktu-terbaik-minum-teh-bunga-telang-dan-deretan-manfaatnya,diabetes
1005,"5 Manfaat Puasa bagi Kesehatan Perempuan, Panjang Umur hingga BB Turun",https://wolipop.detik.com/health-and-diet/d-8375295/5-manfaat-puasa-bagi-kesehatan-perempuan-panjang-umur-hingga-bb-turun,diabetes
1006,Neurolog Ungkap yang Terjadi pada Tubuh saat Minuman Energi Berujung Stroke,https://health.detik.com/berita-detikhealth/d-8260705/neurolog-ungkap-yang-terjadi-pada-tubuh-saat-minuman-energi-berujung-stroke,diabetes
1007,"Stroke gara-gara Makan Sate Kambing bareng Durian, Mitos atau Fakta?",https://health.detik.com/diet/d-8403612/stroke-gara-gara-makan-sate-kambing-bareng-durian-mitos-atau-fakta,diabetes
1008,"6 Buah yang Baik untuk Kesehatan Ginjal, Enak dan Mudah Didapat",https://food.detik.com/info-sehat/d-8394107/6-buah-yang-baik-untuk-kesehatan-ginjal-enak-dan-mudah-didapat,diabetes
1009,"5 Makanan Manis yang Bisa Dimakan Pengidap Diabetes, Tak Cemas Gula Darah Naik",https://health.detik.com/berita-detikhealth/d-7359364/5-makanan-manis-yang-bisa-dimakan-pengidap-diabetes-tak-cemas-gula-darah-naik,diabetes
1010,Penderita Kolesterol Tinggi Bersyukur Biaya Pengobatan Ditanggung JKN,https://news.detik.com/berita/d-7428688/penderita-kolesterol-tinggi-bersyukur-biaya-pengobatan-ditanggung-jkn,diabetes
1011,IDAI Sebut Lifestyle Sebabkan Obesitas pada Anak,https://20.detik.com/detikupdate/20240723-240723139/idai-sebut-lifestyle-sebabkan-obesitas-pada-anak,diabetes
1012,"Kemenkes Catat 5 Temuan Penyakit Terbanyak di Momen Nataru, Banyak yang Hipertensi",https://health.detik.com/berita-detikhealth/d-8283636/kemenkes-catat-5-temuan-penyakit-terbanyak-di-momen-nataru-banyak-yang-hipertensi,diabetes
1013,"Istri Suntik Mati Suami Pakai Insulin, Kesal Diabetesnya Dianggap Sepele",https://www.detik.com/sumbagsel/hukum-dan-kriminal/d-7430928/istri-suntik-mati-suami-pakai-insulin-kesal-diabetesnya-dianggap-sepele,diabetes
1014,"Kemenkes Catat 5 Temuan Penyakit Terbanyak di Momen Nataru, Banyak yang Hipertensi",https://health.detik.com/berita-detikhealth/d-8283636/kemenkes-catat-5-temuan-penyakit-terbanyak-di-momen-nataru-banyak-yang-hipertensi,diabetes
1015,"Khasiat Rebusan Daun Katuk, Bukan Sekadar Bikin ASI Lancar",https://www.detik.com/jogja/kuliner/d-8279610/khasiat-rebusan-daun-katuk-bukan-sekadar-bikin-asi-lancar,diabetes
1016,Minuman Kemasan Tinggi Gula Picu Remaja 18 Tahun Wajib Suntik Insulin,https://health.detik.com/berita-detikhealth/d-7429115/minuman-kemasan-tinggi-gula-picu-remaja-18-tahun-wajib-suntik-insulin,diabetes
1017,Obesitas dan Hipertensi Dominasi Hasil Cek Kesehatan di Cirebon,https://www.detik.com/jabar/cirebon-raya/d-8231623/obesitas-dan-hipertensi-dominasi-hasil-cek-kesehatan-di-cirebon,diabetes
1018,"Hari Gizi Nasional, PERSAGI Soroti Bahaya di Balik Tingginya Konsumsi Makanan UPF",https://health.detik.com/berita-detikhealth/d-8318395/hari-gizi-nasional-persagi-soroti-bahaya-di-balik-tingginya-konsumsi-makanan-upf,diabetes
1019,"Batas Konsumsi Telur yang Aman dalam Sehari, Jangan Berlebihan",https://health.detik.com/berita-detikhealth/d-8246778/batas-konsumsi-telur-yang-aman-dalam-sehari-jangan-berlebihan,diabetes
1020,"Tiap 4 Menit, 1 Orang Meninggal Karena TBC",https://health.detik.com/berita-detikhealth/d-8433878/tiap-4-menit-1-orang-meninggal-karena-tbc,diabetes
1021,Rekomendasi 6 Buah untuk Menjaga Kesehatan Ginjal Setiap Hari,https://www.detik.com/sumut/berita/d-8398052/rekomendasi-6-buah-untuk-menjaga-kesehatan-ginjal-setiap-hari,diabetes
1022,"Terbukti Ilmiah, Ini Menu Sarapan yang Bisa Bantu Turunkan Kolesterol Tinggi",https://health.detik.com/berita-detikhealth/d-8333975/terbukti-ilmiah-ini-menu-sarapan-yang-bisa-bantu-turunkan-kolesterol-tinggi,diabetes
1023,"Sederet Makanan yang Bikin Ginjal Rusak, Nomor 6 Banyak Dikonsumsi Warga RI",https://health.detik.com/berita-detikhealth/d-8433159/sederet-makanan-yang-bikin-ginjal-rusak-nomor-6-banyak-dikonsumsi-warga-ri,diabetes
1024,"Jawab Kebutuhan Peserta, BPJS Kesehatan Beberkan 8 Program Andalan",https://news.detik.com/berita/d-8445662/jawab-kebutuhan-peserta-bpjs-kesehatan-beberkan-8-program-andalan,diabetes
1025,Video Menkes Usul ke Prabowo Adakan Lomba Kementerian yang Paling Sehat,https://health.detik.com/detiktv/d-8262095/video-menkes-usul-ke-prabowo-adakan-lomba-kementerian-yang-paling-sehat,diabetes
1026,"Sederet Khasiat Jeruk Nipis untuk Kesehatan, Bisa Perkuat Imun-Cerahkan Kulit",https://www.detik.com/sumbagsel/berita/d-8290847/sederet-khasiat-jeruk-nipis-untuk-kesehatan-bisa-perkuat-imun-cerahkan-kulit,diabetes
1027,6 Kebiasaan Sehari-hari yang Diam-diam Merusak Ginjal,https://www.detik.com/jabar/berita/d-8377275/6-kebiasaan-sehari-hari-yang-diam-diam-merusak-ginjal,diabetes
1028,"Sering Makan Kentang? Hati-Hati, Cara Mengolahnya Bisa Picu Penyakit Gula",https://health.detik.com/berita-detikhealth/d-8056981/sering-makan-kentang-hati-hati-cara-mengolahnya-bisa-picu-penyakit-gula,diabetes
1029,"Waspadai Jika Urine Seperti Ini, Bisa Jadi Tanda Sakit Ginjal-Infeksi",https://health.detik.com/berita-detikhealth/d-8337440/waspadai-jika-urine-seperti-ini-bisa-jadi-tanda-sakit-ginjal-infeksi,diabetes
1030,5 Cara Diet Gula untuk Wajah Bebas Keriput dan Glowing,https://wolipop.detik.com/health-and-diet/d-8432529/5-cara-diet-gula-untuk-wajah-bebas-keriput-dan-glowing,diabetes
1031,"10 Manfaat Bunga Telang Bagi Tubuh Lengkap Cara Mengolahnya, Simak!",https://www.detik.com/sumbagsel/berita/d-8353470/10-manfaat-bunga-telang-bagi-tubuh-lengkap-cara-mengolahnya-simak,diabetes
1032,"Waktu Ideal Makan Malam untuk Hindari Obesitas, Jam Berapa?",https://www.detik.com/sumut/berita/d-8432325/waktu-ideal-makan-malam-untuk-hindari-obesitas-jam-berapa,diabetes
1033,"10 Manfaat Bunga Telang Bagi Tubuh Lengkap Cara Mengolahnya, Simak!",https://www.detik.com/sumbagsel/berita/d-8353470/10-manfaat-bunga-telang-bagi-tubuh-lengkap-cara-mengolahnya-simak,diabetes
1034,"Sudah 65 Juta Orang Ikut CKG, Menkes Ungkap Masalah Kesehatan Terbanyak",https://health.detik.com/berita-detikhealth/d-8262425/sudah-65-juta-orang-ikut-ckg-menkes-ungkap-masalah-kesehatan-terbanyak,diabetes
1035,"Waktu Ideal Makan Malam untuk Hindari Obesitas, Jam Berapa?",https://www.detik.com/sumut/berita/d-8432325/waktu-ideal-makan-malam-untuk-hindari-obesitas-jam-berapa,diabetes
1036,"Aturan Baru Trump soal Visa, Orang Obesitas Dilarang Masuk AS",https://health.detik.com/berita-detikhealth/d-8211964/aturan-baru-trump-soal-visa-orang-obesitas-dilarang-masuk-as,diabetes
1037,2 Penyakit Mematikan Ini Bisa Muncul gegara Kecanduan Main Hp,https://www.detik.com/jabar/berita/d-8219627/2-penyakit-mematikan-ini-bisa-muncul-gegara-kecanduan-main-hp,diabetes
1038,"Efek Keseringan Main HP Ternyata Kompleks, Nggak Cuma Bikin Brain Rot",https://health.detik.com/berita-detikhealth/d-8219468/efek-keseringan-main-hp-ternyata-kompleks-nggak-cuma-bikin-brain-rot,diabetes
1039,"Pakar Sebut Stres gegara Finansial Bisa Picu Serangan Jantung, Ini Alasannya",https://health.detik.com/berita-detikhealth/d-8337301/pakar-sebut-stres-gegara-finansial-bisa-picu-serangan-jantung-ini-alasannya,diabetes
1040,Apa Itu Operasi Bariatrik? Ini Daftar RS di Jatim yang Melayaninya,https://www.detik.com/jatim/berita/d-8229546/apa-itu-operasi-bariatrik-ini-daftar-rs-di-jatim-yang-melayaninya,diabetes
1041,Manfaat Minum Kopi Bagi Tubuh: Stamina hingga Kesehatan Mental,https://www.detik.com/sumut/berita/d-8312306/manfaat-minum-kopi-bagi-tubuh-stamina-hingga-kesehatan-mental,diabetes
1042,Kenapa Seseorang Mudah Lupa? Ini 11 Penyebab dan Cara Mengatasinya,https://www.detik.com/jogja/berita/d-8410238/kenapa-seseorang-mudah-lupa-ini-11-penyebab-dan-cara-mengatasinya,diabetes
1043,"Jangan Abaikan Kesemutan Berulang, Bisa Jadi Gejala Kena Stroke",https://health.detik.com/berita-detikhealth/d-8254520/jangan-abaikan-kesemutan-berulang-bisa-jadi-gejala-kena-stroke,diabetes
1044,"Generasi Sandwich: Ngurus Dua Generasi, Jangan Lupa Cek Gula Sendiri!",https://health.detik.com/berita-detikhealth/d-8065148/generasi-sandwich-ngurus-dua-generasi-jangan-lupa-cek-gula-sendiri,diabetes
1045,Kenapa Seseorang Mudah Lupa? Ini 11 Penyebab dan Cara Mengatasinya,https://www.detik.com/jogja/berita/d-8410238/kenapa-seseorang-mudah-lupa-ini-11-penyebab-dan-cara-mengatasinya,diabetes
1046,Catat! Ini 5 Cara Mudah untuk Turunkan Gula Darah Tinggi,https://www.detik.com/sumut/berita/d-8122420/catat-ini-5-cara-mudah-untuk-turunkan-gula-darah-tinggi,diabetes
1047,"Bukan Sekadar Lalapan, Bambu Disebut Calon Superfood Kaya Manfaat",https://www.detik.com/edu/detikpedia/d-8321731/bukan-sekadar-lalapan-bambu-disebut-calon-superfood-kaya-manfaat,diabetes
1048,"Kisah Ibu Siti Sholeha Pasien Gagal Ginjal, Berjuang Sembuh Demi Keluarga",https://news.detik.com/berita/d-8321787/kisah-ibu-siti-sholeha-pasien-gagal-ginjal-berjuang-sembuh-demi-keluarga,diabetes
1049,Minum Kopi Bisa Naikkan Gula Darah? Ini Penjelasan Ahli,https://food.detik.com/info-sehat/d-8282759/minum-kopi-bisa-naikkan-gula-darah-ini-penjelasan-ahli,diabetes
1050,"Diungkap Dokter Harvard, Ini Gejala Awal 4 Penyakit Kronis yang Kerap Tak Disadari",https://health.detik.com/berita-detikhealth/d-8258556/diungkap-dokter-harvard-ini-gejala-awal-4-penyakit-kronis-yang-kerap-tak-disadari,diabetes
1051,"Anak Muda Rentan Terkena Fase Prediabetes, Begini Cara Antisipasinya",https://health.detik.com/berita-detikhealth/d-8027461/anak-muda-rentan-terkena-fase-prediabetes-begini-cara-antisipasinya,diabetes
1052,Bumil Makan Nanas dan Durian Bisa Picu Keguguran? Obgyn Ungkap Faktanya,https://health.detik.com/berita-detikhealth/d-8256242/bumil-makan-nanas-dan-durian-bisa-picu-keguguran-obgyn-ungkap-faktanya,diabetes
1053,Minum Kopi Bisa Naikkan Gula Darah? Ini Penjelasan Ahli,https://food.detik.com/info-sehat/d-8282759/minum-kopi-bisa-naikkan-gula-darah-ini-penjelasan-ahli,diabetes
1054,"Diungkap Dokter Harvard, Ini Gejala Awal 4 Penyakit Kronis yang Kerap Tak Disadari",https://health.detik.com/berita-detikhealth/d-8258556/diungkap-dokter-harvard-ini-gejala-awal-4-penyakit-kronis-yang-kerap-tak-disadari,diabetes
1055,"Anak Muda Rentan Terkena Fase Prediabetes, Begini Cara Antisipasinya",https://health.detik.com/berita-detikhealth/d-8027461/anak-muda-rentan-terkena-fase-prediabetes-begini-cara-antisipasinya,diabetes
