,title,link,keyword
1839,"1 dari 10 Anak Idap Obesitas, UNICEF: Ultra Processed Food Lebih Murah dari Buah-Sayur",https://health.detik.com/berita-detikhealth/d-8106974/1-dari-10-anak-idap-obesitas-unicef-ultra-processed-food-lebih-murah-dari-buah-sayur,diabetes
1840,Ternyata Ini Cara Minum Kopi yang Bisa Perpanjang Umur Menurut Studi,https://health.detik.com/berita-detikhealth/d-7963918/ternyata-ini-cara-minum-kopi-yang-bisa-perpanjang-umur-menurut-studi,diabetes
1841,"RS di Cakung Tak Pakai Nama RSUD tapi 'Royal Batavia', Ini Alasannya",https://news.detik.com/berita/d-8078852/rs-di-cakung-tak-pakai-nama-rsud-tapi-royal-batavia-ini-alasannya,diabetes
1842,"China Dilanda Wabah Chikungunya, AS Keluarkan Peringatan Perjalanan Level 2",https://www.detik.com/sumut/berita/d-8052043/china-dilanda-wabah-chikungunya-as-keluarkan-peringatan-perjalanan-level-2,diabetes
1843,Studi Terbaru Ungkap Menu Makan Simpel yang Bisa Jadi Anti-Kanker,https://health.detik.com/berita-detikhealth/d-8157524/studi-terbaru-ungkap-menu-makan-simpel-yang-bisa-jadi-anti-kanker,diabetes
1844,"Masalah Asam Urat Dipicu Faktor Keturunan? Bisa Jadi, Tapi...",https://health.detik.com/berita-detikhealth/d-8207687/masalah-asam-urat-dipicu-faktor-keturunan-bisa-jadi-tapi,diabetes
1845,"7 Manfaat Telur Ayam Kampung untuk Kesehatan, Nomor 5 Perlu Banget!",https://food.detik.com/info-sehat/d-8207184/7-manfaat-telur-ayam-kampung-untuk-kesehatan-nomor-5-perlu-banget,diabetes
1846,"Mikroplastik Cemari Air Hujan Jakarta, Menkes Imbau Warga Pakai Masker",https://news.detik.com/berita/d-8181763/mikroplastik-cemari-air-hujan-jakarta-menkes-imbau-warga-pakai-masker,diabetes
1847,Temuan Baru! Minum Kopi Bisa Bantu Memperlambat Penuaan Biologis,https://food.detik.com/info-sehat/d-8232138/temuan-baru-minum-kopi-bisa-bantu-memperlambat-penuaan-biologis,diabetes
1848,Jangan FOMO! Begini Cara Ikut Tren Makan 12 Anggur Saat Tahun Baru,https://food.detik.com/info-kuliner/d-8280302/jangan-fomo-begini-cara-ikut-tren-makan-12-anggur-saat-tahun-baru,diabetes
1849,"Viral Banyak Minum Air Putih Bikin Ginjal Rusak, Ini Faktanya",https://health.detik.com/berita-detikhealth/d-8076976/viral-banyak-minum-air-putih-bikin-ginjal-rusak-ini-faktanya,diabetes
1850,Pasukan Putih dan JakAmbulans Bikin Layanan Kesehatan Kian Dekat,https://news.detik.com/berita/d-8015790/pasukan-putih-dan-jakambulans-bikin-layanan-kesehatan-kian-dekat,diabetes
1851,"Taylor Swift Doyan Ngemil Roti Sourdough, Ini Manfaatnya untuk Kesehatan",https://wolipop.detik.com/health-and-diet/d-8206859/taylor-swift-doyan-ngemil-roti-sourdough-ini-manfaatnya-untuk-kesehatan,diabetes
1852,Cerita Driver ShopeeFood Lulus Cumlaude hingga Magang di Taiwan,https://news.detik.com/berita/d-8015437/cerita-driver-shopeefood-lulus-cumlaude-hingga-magang-di-taiwan,diabetes
1853,"Viral Banyak Minum Air Putih Bikin Ginjal Rusak, Ini Faktanya",https://health.detik.com/berita-detikhealth/d-8076976/viral-banyak-minum-air-putih-bikin-ginjal-rusak-ini-faktanya,diabetes
1854,Pasukan Putih dan JakAmbulans Bikin Layanan Kesehatan Kian Dekat,https://news.detik.com/berita/d-8015790/pasukan-putih-dan-jakambulans-bikin-layanan-kesehatan-kian-dekat,diabetes
1855,"Taylor Swift Doyan Ngemil Roti Sourdough, Ini Manfaatnya untuk Kesehatan",https://wolipop.detik.com/health-and-diet/d-8206859/taylor-swift-doyan-ngemil-roti-sourdough-ini-manfaatnya-untuk-kesehatan,diabetes
1856,Cerita Driver ShopeeFood Lulus Cumlaude hingga Magang di Taiwan,https://news.detik.com/berita/d-8015437/cerita-driver-shopeefood-lulus-cumlaude-hingga-magang-di-taiwan,diabetes
1857,"Cek Kesehatan Online dengan Skrining BPJS, Gratis dan tak Butuh Waktu Lama!",https://www.detik.com/sumbagsel/berita/d-8289309/cek-kesehatan-online-dengan-skrining-bpjs-gratis-dan-tak-butuh-waktu-lama,diabetes
1858,Ngeri! Peneliti Unair Temukan Mikroplastik dalam Air Ketuban hingga Urin,https://www.detik.com/edu/detikpedia/d-8229641/ngeri-peneliti-unair-temukan-mikroplastik-dalam-air-ketuban-hingga-urin,diabetes
1859,"Jangan Sering Dilakukan, Cara Masak Ini Bisa Merusak Ginjal",https://food.detik.com/info-sehat/d-8179028/jangan-sering-dilakukan-cara-masak-ini-bisa-merusak-ginjal,diabetes
1860,Bolehkah Minum Rebusan Daun Sirih Setiap Hari? Ini Manfaat dan Efek Sampingnya,https://www.detik.com/jogja/kuliner/d-8172777/bolehkah-minum-rebusan-daun-sirih-setiap-hari-ini-manfaat-dan-efek-sampingnya,diabetes
1861,"Diet Bisa Cegah 15 Juta Kematian Dini, Bukan Hanya Tentang Kurus",https://www.detik.com/sumut/berita/d-8154227/diet-bisa-cegah-15-juta-kematian-dini-bukan-hanya-tentang-kurus,diabetes
1862,Khasiat Buah Naga Kuning Lengkap Berbagai Olahan untuk Ide Bisnis,https://www.detik.com/sumbagsel/kuliner/d-8287755/khasiat-buah-naga-kuning-lengkap-berbagai-olahan-untuk-ide-bisnis,diabetes
1863,"Diet Bisa Cegah 15 Juta Kematian Dini, Bukan Hanya Tentang Kurus",https://www.detik.com/sumut/berita/d-8154227/diet-bisa-cegah-15-juta-kematian-dini-bukan-hanya-tentang-kurus,diabetes
1864,Catat! Ini 7 Minuman yang Perlu Dibatasi Demi Kesehatan Optimal,https://www.detik.com/sumut/berita/d-8278052/catat-ini-7-minuman-yang-perlu-dibatasi-demi-kesehatan-optimal,diabetes
1865,Ini Biang Kerok Kasus Gagal Ginjal di Usia Muda Melonjak,https://www.detik.com/sumut/berita/d-8127093/ini-biang-kerok-kasus-gagal-ginjal-di-usia-muda-melonjak,diabetes
1866,"Pekan ASI Sedunia 1-7 Agustus 2025, Simak Tema hingga Mitos Ibu Menyusui",https://www.detik.com/jabar/jabar-gaskeun/d-8039799/pekan-asi-sedunia-1-7-agustus-2025-simak-tema-hingga-mitos-ibu-menyusui,diabetes
1867,Cara Membuat Rebusan Kapulaga dan Jahe untuk Pencernaan,https://www.detik.com/jabar/kuliner/d-8177503/cara-membuat-rebusan-kapulaga-dan-jahe-untuk-pencernaan,diabetes
1868,Cara Menanam Lidah Buaya agar Cepat Besar dan 15 Manfaatnya,https://www.detik.com/jogja/berita/d-8311521/cara-menanam-lidah-buaya-agar-cepat-besar-dan-15-manfaatnya,diabetes
1869,Ibu Suri Thailand Meninggal di Usia 93 gegara Sakit Komplikasi Sepsis Darah,https://health.detik.com/berita-detikhealth/d-8177568/ibu-suri-thailand-meninggal-di-usia-93-gegara-sakit-komplikasi-sepsis-darah,diabetes
1870,"Daun Belimbing Jadi Incaran Negara Asing, Ini Khasiat Medisnya",https://health.detik.com/berita-detikhealth/d-7998415/daun-belimbing-jadi-incaran-negara-asing-ini-khasiat-medisnya,diabetes
1871,Lewatkan Sarapan Bisa Turunkan BB? Cek Faktanya!,https://health.detik.com/diet/d-8125020/lewatkan-sarapan-bisa-turunkan-bb-cek-faktanya,diabetes
1872,"5 Negara Paling Ramah Vegetarian, Surga Kuliner Tanpa Daging",https://food.detik.com/info-kuliner/d-8427062/5-negara-paling-ramah-vegetarian-surga-kuliner-tanpa-daging,diabetes
1873,Hati-hati! Kesehatan Mulut yang Buruk Bisa Picu Kanker Pankreas,https://health.detik.com/berita-detikhealth/d-8122847/hati-hati-kesehatan-mulut-yang-buruk-bisa-picu-kanker-pankreas,diabetes
1874,Khasiat Buah Naga Kuning Lengkap Berbagai Olahan untuk Ide Bisnis,https://www.detik.com/sumbagsel/kuliner/d-8287755/khasiat-buah-naga-kuning-lengkap-berbagai-olahan-untuk-ide-bisnis,diabetes
1875,"Beda Tahap Beda Rasa, Ini 5 Tingkat Kematangan Pisang dan Nutrisinya",https://food.detik.com/info-sehat/d-8222168/beda-tahap-beda-rasa-ini-5-tingkat-kematangan-pisang-dan-nutrisinya,diabetes
1876,Kenali 6 Bahan Skincare dan Selfcare Berbahaya yang Bisa Picu Kanker,https://wolipop.detik.com/makeup-and-skincare/d-8121388/kenali-6-bahan-skincare-dan-selfcare-berbahaya-yang-bisa-picu-kanker,diabetes
1877,"3 Manfaat Jalan Kaki 15 Menit yang Tak Terduga, Termasuk Bikin Panjang Umur",https://health.detik.com/kebugaran/d-8095130/3-manfaat-jalan-kaki-15-menit-yang-tak-terduga-termasuk-bikin-panjang-umur,diabetes
1878,Video: Mitos atau Fakta: Tubuh Sulit Proses Gula saat Massa Otot Sedikit,https://20.detik.com/detikupdate/20250413-250413058/video-mitos-atau-fakta-tubuh-sulit-proses-gula-saat-massa-otot-sedikit,diabetes
1879,MHBD-BRI Life Tingkatkan Layanan Lewat Lounge Eksklusif dan Sugar Clinic,https://health.detik.com/berita-detikhealth/d-8245121/mhbd-bri-life-tingkatkan-layanan-lewat-lounge-eksklusif-dan-sugar-clinic,diabetes
1880,"Daftar Tanggal Merah November 2025, Yuk Cek dan Rencanakan Liburanmu!",https://www.detik.com/sulsel/berita/d-8169887/daftar-tanggal-merah-november-2025-yuk-cek-dan-rencanakan-liburanmu,diabetes
1881,Video Ray Sahetapy Idap Komplikasi Penyakit Sebelum Meninggal,https://20.detik.com/detikupdate/20250402-250402067/video-ray-sahetapy-idap-komplikasi-penyakit-sebelum-meninggal,diabetes
1882,Ini Perubahan yang Terjadi Pada Tubuh Jika Berpuasa Selama 24 Jam,https://health.detik.com/berita-detikhealth/d-8066543/ini-perubahan-yang-terjadi-pada-tubuh-jika-berpuasa-selama-24-jam,diabetes
1883,MHBD-BRI Life Tingkatkan Layanan Lewat Lounge Eksklusif dan Sugar Clinic,https://health.detik.com/berita-detikhealth/d-8245121/mhbd-bri-life-tingkatkan-layanan-lewat-lounge-eksklusif-dan-sugar-clinic,diabetes
1884,"Daftar Tanggal Merah November 2025, Yuk Cek dan Rencanakan Liburanmu!",https://www.detik.com/sulsel/berita/d-8169887/daftar-tanggal-merah-november-2025-yuk-cek-dan-rencanakan-liburanmu,diabetes
1885,Ini Perubahan yang Terjadi Pada Tubuh Jika Berpuasa Selama 24 Jam,https://health.detik.com/berita-detikhealth/d-8066543/ini-perubahan-yang-terjadi-pada-tubuh-jika-berpuasa-selama-24-jam,diabetes
1886,"5 Manfaat Makan Pare Buat Kesehatan, Si Pahit dengan Segudang Khasiat",https://food.detik.com/info-sehat/d-7992011/5-manfaat-makan-pare-buat-kesehatan-si-pahit-dengan-segudang-khasiat,diabetes
1887,Kondisi yang Tak Disadari Rentan Picu Serangan Stroke di Usia Muda,https://health.detik.com/berita-detikhealth/d-8268614/kondisi-yang-tak-disadari-rentan-picu-serangan-stroke-di-usia-muda,diabetes
1888,"Wanita Kena Stroke di Usia 28 Tahun gegara Stres, Ini Gejala Awalnya",https://health.detik.com/berita-detikhealth/d-8267917/wanita-kena-stroke-di-usia-28-tahun-gegara-stres-ini-gejala-awalnya,diabetes
1889,"Lama Hilang, Kasus Chikungunya Kembali Muncul di New York",https://www.detik.com/jabar/berita/d-8168312/lama-hilang-kasus-chikungunya-kembali-muncul-di-new-york,diabetes
1890,"7 Manfaat Timun untuk Kesehatan, Ketahui Cara Makan dan Efek Sampingnya!",https://www.detik.com/jogja/kuliner/d-7924466/7-manfaat-timun-untuk-kesehatan-ketahui-cara-makan-dan-efek-sampingnya,diabetes
1891,Kemenkes Kaji Pemberian Vaksin Campak untuk Tenaga Kesehatan,https://health.detik.com/berita-detikhealth/d-8422119/kemenkes-kaji-pemberian-vaksin-campak-untuk-tenaga-kesehatan,diabetes
1892,Ladies! Ini Waktu yang Tepat untuk Minum Kopi Agar Panjang Umur,https://food.detik.com/info-kuliner/d-8167336/ladies-ini-waktu-yang-tepat-untuk-minum-kopi-agar-panjang-umur,diabetes
1893,Kemenkes Bakal Bangun Bank Data Genomik di Bogor,https://health.detik.com/berita-detikhealth/d-8191941/kemenkes-bakal-bangun-bank-data-genomik-di-bogor,diabetes
1894,Wanita di Iran Bunuh 11 Suami Demi Dapatkan Warisan,https://www.detik.com/sumut/hukum-dan-kriminal/d-8051080/wanita-di-iran-bunuh-11-suami-demi-dapatkan-warisan,diabetes
1895,Penyebab Gen Z Susah Tidur dan Cara Mengatasinya,https://www.detik.com/jabar/berita/d-8258000/penyebab-gen-z-susah-tidur-dan-cara-mengatasinya,diabetes
1896,Mayapada Hospital Surabaya Teguhkan Posisi Jadi Pionir Ortopedi Robotik,https://www.detik.com/jatim/berita/d-8056114/mayapada-hospital-surabaya-teguhkan-posisi-jadi-pionir-ortopedi-robotik,diabetes
1897,7 Kebiasaan Sehari-hari yang Tanpa Disadari Bisa Picu Stroke,https://health.detik.com/berita-detikhealth/d-7937265/7-kebiasaan-sehari-hari-yang-tanpa-disadari-bisa-picu-stroke,diabetes
1898,Waspada! Screen Time Berlebih di Akhir Pekan Bisa Picu Penyakit,https://www.detik.com/jatim/berita/d-8063028/waspada-screen-time-berlebih-di-akhir-pekan-bisa-picu-penyakit,diabetes
1899,Kenapa Bau Badan Muncul Meski Sudah Mandi? Ini Kata Ahli,https://health.detik.com/berita-detikhealth/d-7989502/kenapa-bau-badan-muncul-meski-sudah-mandi-ini-kata-ahli,diabetes
1900,"Makan Tahu Setiap Hari, Ini Manfaat dan Efek Sampingnya",https://food.detik.com/berita-boga/d-7877142/makan-tahu-setiap-hari-ini-manfaat-dan-efek-sampingnya,diabetes
1901,Ratusan Warga di Brebes Konsultasi Kesehatan Gratis Lewat Program Speling,https://news.detik.com/bangun-indonesia/d-8142074/ratusan-warga-di-brebes-konsultasi-kesehatan-gratis-lewat-program-speling,diabetes
1902,Gubernur Jateng Tinjau Layanan Dokter Spesialis Keliling di Brebes,https://news.detik.com/bangun-indonesia/d-8142069/gubernur-jateng-tinjau-layanan-dokter-spesialis-keliling-di-brebes,diabetes
1903,"7 Manfaat Cokelat untuk Otak, Kulit, dan Kesehatan Jantung",https://www.detik.com/jabar/kuliner/d-8188761/7-manfaat-cokelat-untuk-otak-kulit-dan-kesehatan-jantung,diabetes
1904,Narji Punya Lahan 1.000 Hektar hingga Indomie Jadi Mie Instan Terenak,https://food.detik.com/berita-boga/d-8114016/narji-punya-lahan-1-000-hektar-hingga-indomie-jadi-mie-instan-terenak,diabetes
1905,Pengakuan Anak Pasien RSUD Sekayu yang Marah dan Suruh Masker Dokter Dibuka,https://news.detik.com/berita/d-8062597/pengakuan-anak-pasien-rsud-sekayu-yang-marah-dan-suruh-masker-dokter-dibuka,diabetes
1906,"Gawat, Iklan Judol Nyamar dan Incar Korban di Facebook hingga Instagram",https://inet.detik.com/security/d-8213356/gawat-iklan-judol-nyamar-dan-incar-korban-di-facebook-hingga-instagram,diabetes
1907,Dinkes Buleleng Ungkap Berbagai Penyakit yang Diidap Warga,https://www.detik.com/bali/berita/d-8035459/dinkes-buleleng-ungkap-berbagai-penyakit-yang-diidap-warga,diabetes
1908,Dokter Ungkap Tanda Serangan Jantung yang Bisa Muncul Sebulan Sebelumnya,https://health.detik.com/berita-detikhealth/d-8237057/dokter-ungkap-tanda-serangan-jantung-yang-bisa-muncul-sebulan-sebelumnya,diabetes
1909,"Resep 'Murah' Awet Muda, Riset: Kuasai Banyak Bahasa!",https://www.detik.com/edu/detikpedia/d-8212674/resep-murah-awet-muda-riset-kuasai-banyak-bahasa,diabetes
1910,Kemenkes Kaji Pemberian Vaksin Campak untuk Tenaga Kesehatan,https://health.detik.com/berita-detikhealth/d-8422119/kemenkes-kaji-pemberian-vaksin-campak-untuk-tenaga-kesehatan,diabetes
1911,Dokter Wanti-wanti Bahaya Minuman Energi di Usia Muda yang Berujung Stroke,https://health.detik.com/berita-detikhealth/d-8260004/dokter-wanti-wanti-bahaya-minuman-energi-di-usia-muda-yang-berujung-stroke,diabetes
1912,Biar Nggak Gagal Berangkat! Ini Syarat Kesehatan Haji yang Wajib Dipenuhi,https://www.detik.com/hikmah/haji-dan-umrah/d-7961562/biar-nggak-gagal-berangkat-ini-syarat-kesehatan-haji-yang-wajib-dipenuhi,diabetes
1913,Biar Nggak Gagal Berangkat! Ini Syarat Kesehatan Haji yang Wajib Dipenuhi,https://www.detik.com/hikmah/haji-dan-umrah/d-7961562/biar-nggak-gagal-berangkat-ini-syarat-kesehatan-haji-yang-wajib-dipenuhi,diabetes
1914,7 Penyebab Haid Datang Terlambat yang Bukan karena Kehamilan,https://wolipop.detik.com/health-and-diet/d-8000396/7-penyebab-haid-datang-terlambat-yang-bukan-karena-kehamilan,diabetes
1915,"Dokter Berikan Cara Sehat Makan Gorengan, Begini Tipsnya",https://health.detik.com/berita-detikhealth/d-8086274/dokter-berikan-cara-sehat-makan-gorengan-begini-tipsnya,diabetes
1916,Tetap Bugar! Ini Panduan Aman Olahraga Saat Puasa Ramadan,https://www.detik.com/jabar/jabar-gaskeun/d-8376714/tetap-bugar-ini-panduan-aman-olahraga-saat-puasa-ramadan,diabetes
1917,"Menguak Rahasia Hidup Panjang Maria Branyas, Manusia Tertua di Dunia",https://www.detik.com/jabar/berita/d-8134156/menguak-rahasia-hidup-panjang-maria-branyas-manusia-tertua-di-dunia,diabetes
1918,Makan Malam Jam Berapa yang Paling Baik? Ini Penjelasan Pakar,https://food.detik.com/info-sehat/d-8083833/makan-malam-jam-berapa-yang-paling-baik-ini-penjelasan-pakar,diabetes
1919,"China-Singapura Dihantui Chikungunya, RI Aman? Kemenkes Bilang Gini",https://health.detik.com/berita-detikhealth/d-8056570/china-singapura-dihantui-chikungunya-ri-aman-kemenkes-bilang-gini,diabetes
1920,"Ciri-ciri Gula Darah Tinggi yang Perlu Diwaspadai, Apa Saja?",https://www.detik.com/jateng/berita/d-8012342/ciri-ciri-gula-darah-tinggi-yang-perlu-diwaspadai-apa-saja,diabetes
1921,Daftar 8 Makanan Pembersih Ginjal Alami yang Aman dan Menyehatkan,https://health.detik.com/berita-detikhealth/d-8232132/daftar-8-makanan-pembersih-ginjal-alami-yang-aman-dan-menyehatkan,diabetes
1922,5 Makanan dan Minuman yang Bisa Picu Gagal Ginjal di Usia Muda,https://www.detik.com/jabar/berita/d-8133106/5-makanan-dan-minuman-yang-bisa-picu-gagal-ginjal-di-usia-muda,diabetes
1923,"'Tsunami' Penyakit Ginjal Kronis di Singapura, Bisa Capai 900 Ribu Kasus di 2035",https://health.detik.com/berita-detikhealth/d-7842198/tsunami-penyakit-ginjal-kronis-di-singapura-bisa-capai-900-ribu-kasus-di-2035,diabetes
1924,"Alarm Bahaya UNICEF, Makin Banyak Anak-Remaja Obesitas! Ini Dampaknya",https://health.detik.com/berita-detikhealth/d-8106491/alarm-bahaya-unicef-makin-banyak-anak-remaja-obesitas-ini-dampaknya,diabetes
1925,26 November Hari Apa? Ini Daftar Peringatannya,https://www.detik.com/jabar/jabar-gaskeun/d-8227752/26-november-hari-apa-ini-daftar-peringatannya,diabetes
1926,"Cerita Titik, Telaten Rawat ODGJ hingga Penyintas Kanker di Rumahnya Klaten",https://www.detik.com/jateng/berita/d-8301923/cerita-titik-telaten-rawat-odgj-hingga-penyintas-kanker-di-rumahnya-klaten,diabetes
1927,"Tak Ada Larangan Konsumsi Buah Sebelum Makan Utama, Justru Ini Manfaatnya",https://health.detik.com/diet/d-8251939/tak-ada-larangan-konsumsi-buah-sebelum-makan-utama-justru-ini-manfaatnya,diabetes
1928,Tetap Bugar! Ini Panduan Aman Olahraga Saat Puasa Ramadan,https://www.detik.com/jabar/jabar-gaskeun/d-8376714/tetap-bugar-ini-panduan-aman-olahraga-saat-puasa-ramadan,diabetes
1929,Sering Makan Gorengan? Ini 4 Penyakit yang Mengancam,https://food.detik.com/info-sehat/d-7814215/sering-makan-gorengan-ini-4-penyakit-yang-mengancam,diabetes
1930,Makan Kuning Telur Bikin Kolesterol Tinggi? Ini Penjelasannya,https://health.detik.com/berita-detikhealth/d-8078828/makan-kuning-telur-bikin-kolesterol-tinggi-ini-penjelasannya,diabetes
1931,Misteri Tewasnya Sultan Jogja HB V di Tangan Istri Kelima,https://www.detik.com/jogja/berita/d-8122635/misteri-tewasnya-sultan-jogja-hb-v-di-tangan-istri-kelima,diabetes
1932,Studi Baru Ungkap Minum Kopi Bisa Bantu Wanita Menua dengan Sehat,https://food.detik.com/info-sehat/d-8177685/studi-baru-ungkap-minum-kopi-bisa-bantu-wanita-menua-dengan-sehat,diabetes
1933,"Dokter Ungkap Gejala Gagal Ginjal Mirip Maag, Waspadai Jika Mengalaminya",https://health.detik.com/berita-detikhealth/d-8077054/dokter-ungkap-gejala-gagal-ginjal-mirip-maag-waspadai-jika-mengalaminya,diabetes
1934,5 Makanan yang Harus Dibatasi agar Paru-Paru Sehat dan Pernapasan Lancar,https://food.detik.com/info-sehat/d-8176595/5-makanan-yang-harus-dibatasi-agar-paru-paru-sehat-dan-pernapasan-lancar,diabetes
1935,"Tanda Jantung Bermasalah yang Bisa Muncul di Kaki, Usia Muda Wajib Waspada",https://health.detik.com/berita-detikhealth/d-7899995/tanda-jantung-bermasalah-yang-bisa-muncul-di-kaki-usia-muda-wajib-waspada,diabetes
1936,Cara Isi Skrining BPJS Kesehatan September 2025: dari Ponsel dan Website Resmi,https://www.detik.com/bali/berita/d-8101693/cara-isi-skrining-bpjs-kesehatan-september-2025-dari-ponsel-dan-website-resmi,diabetes
1937,Aksi Keji Akbari Bunuh 11 Suami demi Kuasai Warisan,https://www.detik.com/bali/hukum-dan-kriminal/d-8051152/aksi-keji-akbari-bunuh-11-suami-demi-kuasai-warisan,diabetes
1938,"Ahli Ungkap Waktu Terbaik Minum Kopi, Paling Bermanfaat Dikonsumsi di Jam Ini",https://health.detik.com/berita-detikhealth/d-7867062/ahli-ungkap-waktu-terbaik-minum-kopi-paling-bermanfaat-dikonsumsi-di-jam-ini,diabetes
1939,Pemeran Bond Girl Hamil Pertama Kali di Usia 47 Setelah Perjuangan Panjang IVF,https://wolipop.detik.com/entertainment-news/d-7998927/pemeran-bond-girl-hamil-pertama-kali-di-usia-47-setelah-perjuangan-panjang-ivf,diabetes
1940,Apakah Bihun Bagus untuk Diet? Ini Fakta Gizi dan Tips Konsumsinya,https://wolipop.detik.com/health-and-diet/d-8024614/apakah-bihun-bagus-untuk-diet-ini-fakta-gizi-dan-tips-konsumsinya,diabetes
1941,Harus Minum Kopi Berapa Gelas Sehari Biar Tak Mati Muda karena Sakit Jantung?,https://health.detik.com/berita-detikhealth/d-8050028/harus-minum-kopi-berapa-gelas-sehari-biar-tak-mati-muda-karena-sakit-jantung,diabetes
1942,"Cerita Titik, Telaten Rawat ODGJ hingga Penyintas Kanker di Rumahnya Klaten",https://www.detik.com/jateng/berita/d-8301923/cerita-titik-telaten-rawat-odgj-hingga-penyintas-kanker-di-rumahnya-klaten,diabetes
1943,"Tingkatkan Layanan, Mayapada Healthcare Gandeng Bupa International",https://health.detik.com/berita-detikhealth/d-7964572/tingkatkan-layanan-mayapada-healthcare-gandeng-bupa-international,diabetes
1944,"Hati-hati, Kebiasaan Makan yang Jarang Disadari Tingkatkan Risiko Kena Stroke",https://health.detik.com/berita-detikhealth/d-7871856/hati-hati-kebiasaan-makan-yang-jarang-disadari-tingkatkan-risiko-kena-stroke,diabetes
1945,"7 Makanan Ini Bisa Picu Gangguan Penglihatan, Batasi Konsumsinya",https://food.detik.com/info-sehat/d-8196700/7-makanan-ini-bisa-picu-gangguan-penglihatan-batasi-konsumsinya,diabetes
1946,"30 Hari Berhenti Konsumsi Gula, Dokter Ungkap Manfaatnya Terhadap Tubuh",https://www.detik.com/sumut/berita/d-7996792/30-hari-berhenti-konsumsi-gula-dokter-ungkap-manfaatnya-terhadap-tubuh,diabetes
1947,Ini Waktu Sarapan Paling Ideal untuk Kesehatan Tubuh Menurut Sains,https://wolipop.detik.com/health-and-diet/d-8148458/ini-waktu-sarapan-paling-ideal-untuk-kesehatan-tubuh-menurut-sains,diabetes
1948,"Cerita Titik, Telaten Rawat ODGJ hingga Penyintas Kanker di Rumahnya Klaten",https://www.detik.com/jateng/berita/d-8301923/cerita-titik-telaten-rawat-odgj-hingga-penyintas-kanker-di-rumahnya-klaten,diabetes
1949,Orang dengan Masalah Kesehatan Berikut Tak Dianjurkan Berjalan Jauh,https://www.detik.com/kalimantan/berita/d-7962315/orang-dengan-masalah-kesehatan-berikut-tak-dianjurkan-berjalan-jauh,diabetes
1950,Hakim Ini Soroti Tulisan Resep Dokter yang Mirip 'Ceker Ayam',https://www.detik.com/jabar/berita/d-8145743/hakim-ini-soroti-tulisan-resep-dokter-yang-mirip-ceker-ayam,diabetes
1951,Ini yang Terjadi Pada Tubuh Saat Setop Minuman Manis Selama 30 Hari,https://health.detik.com/berita-detikhealth/d-8097783/ini-yang-terjadi-pada-tubuh-saat-setop-minuman-manis-selama-30-hari,diabetes
1952,"Tanggal Merah November 2025, Cek Informasi Lengkapnya di Sini!",https://www.detik.com/sulsel/berita/d-8193954/tanggal-merah-november-2025-cek-informasi-lengkapnya-di-sini,diabetes
1953,Ini yang Terjadi Pada Tubuh Saat Setop Minuman Manis Selama 30 Hari,https://health.detik.com/berita-detikhealth/d-8097783/ini-yang-terjadi-pada-tubuh-saat-setop-minuman-manis-selama-30-hari,diabetes
1954,5 Cara Merawat Luka Diabetes untuk Cegah Risiko Infeksi,https://www.detik.com/bali/berita/d-7333273/5-cara-merawat-luka-diabetes-untuk-cegah-risiko-infeksi,diabetes
1955,Jalan Kaki 15 Menit Setiap Hari Bisa Cegah Kematian Dini,https://www.detik.com/sumut/berita/d-8096278/jalan-kaki-15-menit-setiap-hari-bisa-cegah-kematian-dini,diabetes
1956,"Daftar Makanan-Minuman yang Merusak Ginjal secara Perlahan, Batasi Konsumsinya",https://health.detik.com/berita-detikhealth/d-7920282/daftar-makanan-minuman-yang-merusak-ginjal-secara-perlahan-batasi-konsumsinya,diabetes
1957,"Ancaman Serius, Peneliti Ramal Kasus Kanker Hati Bakal Meningkat, Ini Pemicunya",https://health.detik.com/berita-detikhealth/d-8043830/ancaman-serius-peneliti-ramal-kasus-kanker-hati-bakal-meningkat-ini-pemicunya,diabetes
1958,Perlukah Minum Obat Hipertensi saat Tekanan Darah Sudah Normal?,https://health.detik.com/berita-detikhealth/d-8119128/perlukah-minum-obat-hipertensi-saat-tekanan-darah-sudah-normal,diabetes
1959,"Tak Hanya Asri, Tanam Lidah Buaya Bisa Bantu Tidur Lebih Nyenyak",https://www.detik.com/properti/tips-dan-panduan/d-8237448/tak-hanya-asri-tanam-lidah-buaya-bisa-bantu-tidur-lebih-nyenyak,diabetes
1960,6 Manfaat Bunga Telang untuk Kesehatan dan Cara Mengonsumsinya,https://health.detik.com/berita-detikhealth/d-7932323/6-manfaat-bunga-telang-untuk-kesehatan-dan-cara-mengonsumsinya,diabetes
1961,"32 Juta Warga RI Ikut CKG, Kemenkes Ungkap Temuan Penyakit Terbanyak",https://health.detik.com/berita-detikhealth/d-8118316/32-juta-warga-ri-ikut-ckg-kemenkes-ungkap-temuan-penyakit-terbanyak,diabetes
1962,"Fakta-fakta Meninggalnya Paus Fransiskus, Riwayat Sakit sampai Penyebab Kematian",https://health.detik.com/berita-detikhealth/d-7879729/fakta-fakta-meninggalnya-paus-fransiskus-riwayat-sakit-sampai-penyebab-kematian,diabetes
1963,9 Manfaat Minum Air Kelapa secara Rutin untuk Jantung Sehat,https://health.detik.com/berita-detikhealth/d-8008573/9-manfaat-minum-air-kelapa-secara-rutin-untuk-jantung-sehat,diabetes
1964,5 Cara Merawat Luka Diabetes untuk Cegah Risiko Infeksi,https://www.detik.com/bali/berita/d-7333273/5-cara-merawat-luka-diabetes-untuk-cegah-risiko-infeksi,diabetes
1965,"Waspada, Kebiasaan Makan Ini Bisa Tingkatkan Risiko Jantung dan Stroke",https://www.detik.com/sumut/berita/d-7872492/waspada-kebiasaan-makan-ini-bisa-tingkatkan-risiko-jantung-dan-stroke,diabetes
1966,"Pengadilan India Perintahkan Dokter Perjelas Tulisan Resep, Jangan 'Cakar Ayam'",https://health.detik.com/berita-detikhealth/d-8138870/pengadilan-india-perintahkan-dokter-perjelas-tulisan-resep-jangan-cakar-ayam,diabetes
1967,Detail Rencana Pemakaman Ray Sahetapy,https://hot.detik.com/celeb/d-7853465/detail-rencana-pemakaman-ray-sahetapy,diabetes
1968,Pakar Ingatkan Risiko Penyakit Pascabencana di Aceh-Sumut,https://health.detik.com/berita-detikhealth/d-8232883/pakar-ingatkan-risiko-penyakit-pascabencana-di-aceh-sumut,diabetes
1969,Arti Warna Sayur dan Buah Serta Manfaatnya bagi Kesehatan Tubuh,https://www.detik.com/jabar/berita/d-8277209/arti-warna-sayur-dan-buah-serta-manfaatnya-bagi-kesehatan-tubuh,diabetes
1970,"5 Makanan Sehat Ini Tergolong Ultra Proses, Jangan Kebanyakan Dimakan!",https://food.detik.com/info-sehat/d-8277710/5-makanan-sehat-ini-tergolong-ultra-proses-jangan-kebanyakan-dimakan,diabetes
